Application:
QUALITÉ

Theme:
Normalisation et qualité

Type:
Décret

Numero:
2009-1504

Date:
2009-05-18

Titre:
 Approbation du statut particulier des agents de l’institut national de la normalisation et de la propriété industrielle

Resume:
- Article premier : Le statut particulier des agents de l’institut national de la normalisation et de la propriété industrielle annexé au présent décret est approuvé.


==================================================

Application:
QUALITÉ

Theme:
Normalisation et qualité

Type:
Décret

Numero:
83-724

Date:
1983-08-03

Titre:
Fixant les catégories de normes et le modalités de leur élaboration et de leur diffusion

Resume:
Ce présent décret fixe le statut des normes, le programme général et la procédure de l’élaboration des normes, l'enquête technique et l'homologation des normes


==================================================

Application:
QUALITÉ

Theme:
Contrôle métrologique

Type:
Décret

Numero:
2001-588

Date:
2001-02-26

Titre:
Fixation des redevances à percevoir pour les opérations de contrôles métrologiques légaux des instruments de mesure

Resume:
Portant fixation des redevances à percevoir pour les opérations de contrôles métrologiques légaux des instruments de mesure et de modalités de recouvrement. - Article 1 : Les travaux relatifs a l'approbation de modèles de d'instruments de mesures, et la prorogation de décisions d'approbation de modèles donnent lieu à la perception d'une redevance horaire de cinq dinars. Toute fraction d'une heure est considérée comme un e heure entière. - Article 2+3 : Les redevances à percevoir pour les opérations de vérification primitive et périodique des instruments de mesure effectuées lors de tournée de vérification ou dans et dehors les locaux des services de la métrologie légales sont fixées dans le tableau "A" annexée au présent décret . Les redevances à percevoir pour les opérations de contrôle technique en vue d'une expertise ou talonnage des instruments de mesure soumis aux contrôles métrologiques légaux donnent lieu à la perception d'une redevance horaire de 10 dinars.


==================================================

Application:
QUALITÉ

Theme:
Contrôle métrologique

Type:
Décret

Numero:
2001-1036

Date:
2001-05-08

Titre:
Fixant les modalités des contrôles métrologiques légaux, les caractéristiques des marques de contrôle

Resume:
Fixant les modalités des contrôles métrologiques légaux, les caractéristiques des marques de contrôle et les conditions dans lesquelles elles sont opposées sur les instruments de mesure. Ce présent décret fixe les modalités de contrôle métrologiques légales et les les caractéristiques des marques de contrôle des instruments de mesure, ainsi que les conditions dans les quelles elles sont opposées.


==================================================

Application:
QUALITÉ

Theme:
Contrôle métrologique

Type:
Décret

Numero:
2001-1205

Date:
2001-05-22

Titre:
Fixant les conditions d'importation et d'exportation des instruments de mesure soumis au contrôle métrologique légal

Resume:
Ce présent décret fixe les conditions d'importation et d'exportation des instruments de mesure soumis au contrôle métrologique légal. La liste de ces instruments par numéro de tarif douanier sera fixé chaque fois que nécessaire par arrêté du ministre de commerce.


==================================================

Application:
QUALITÉ

Theme:
Contrôle métrologique

Type:
Décret

Numero:
2001-2145

Date:
2001-09-10

Titre:
Les conditions d’agrément des organismes chargés de tout ou partie d’opérations de contrôle métrologique légal

Resume:
Ce présent décret fixe les conditions auxquelles doivent satisfaire les organismes chargés d'exécuter tout ou partie d’opérations de contrôle métrologique de certaines catégories d'instruments de mesures.


==================================================

Application:
QUALITÉ

Theme:
Contrôle métrologique

Type:
Décret

Numero:
2009-440

Date:
2009-02-16

Titre:
fixation du montant des redevances à percevoir pour l’opération de contrôle métrologique des instruments de mesure

Resume:
Fixation du montant des redevances à percevoir pour l’opération de contrôle métrologique des instruments de mesure et des modalités de leur recouvrement.


==================================================

Application:
QUALITÉ

Theme:
Contrôle métrologique

Type:
Arrêté

Numero:
2018-1353

Date:
2018-04-06

Titre:
L'agrément du laboratoire central d'analyses  pour l'exercice des activités de vérification des instruments de pesage

Resume:
Portant approbation de l'agrément du laboratoire central d'analyses et d'essais pour l'exercice des activités de vérification primitive et périodique des instruments de pesage à fonctionnement non automatique de portée maximale supérieure à 30 kilogrammes - Article 8 : Le demandeur de la vérification primitive ou de la vérification périodique des instruments de pesage à fonctionnement non automatique de portée maximale supérieure à 30 kilogrammes, procède au paiement du montant de la redevance à percevoir sur les opérations de contrôle métrologique légal conformément aux dispositions du décret n° 2009-440 du 16 février 2009 susvisé. Le montant de la redevance est assujetti à une taxe sur la valeur ajoutée (TVA) de 19% conformément aux règlements en vigueur. L’opération de paiement de ce montant s’effectue au siège de l’agence nationale de métrologie moyennant un chèque bancaire ou postal.


==================================================

Application:
QUALITÉ

Theme:
Contrôle métrologique

Type:
Arrêté

Numero:
05-03-2019

Date:
2019-03-05

Titre:
Relatif au contrôle métrologique légal des dispositifs de mesure de la vitesse dans les routes

Resume:
Un résumé illustrant les principales exigences sera affiché dès que la version française sera publiée


==================================================

Application:
QUALITÉ

Theme:
Etalonnage

Type:
Décret

Numero:
2002-105

Date:
2002-01-21

Titre:
Les conditions et procédures de notifications et laboratoires d'étalonnage habilités à fournir des prestations métrologiques

Resume:
Ce présent décret fixe les conditions et procédures de notifications et laboratoires d'étalonnage habilités à fournir des prestations métrologiques dans le cadre des activités afférentes à la métrologie légale et notamment celles des opérations de contrôle de métrologiques légaux.


==================================================

Application:
QUALITÉ

Theme:
Métrologie

Type:
Arrêté

Numero:
11-12-2025

Date:
2025-12-11

Titre:
Relatif aux opérations de vérification et de poinçonnage des instruments de mesure pour l’année 2026

Resume:
L’arrêté du ministre du Commerce et du Développement des Exportations du 11 décembre 2025 fixe les modalités et le calendrier des opérations de vérification et de poinçonnage des instruments de mesure pour l’année 2026. Il précise les règles applicables aux contrôles métrologiques périodiques, visant à assurer la fiabilité et l’exactitude des instruments de mesure utilisés dans le commerce et l’industrie, conformément aux dispositions légales en vigueur.


==================================================

Application:
QUALITÉ

Theme:
Métrologie

Type:
Décision 

Numero:
11/12/2024

Date:
2024-12-11

Titre:
Décision du Ministre du Commerce du 11/12/2024 relative aux opérations de vérification et de marquage des instruments de mesure

Resume:
Objectif de la décision Cette décision établit les modalités de vérification périodique obligatoire et de marquage des instruments de mesure utilisés à des fins légales, commerciales ou industrielles pour l’année 2025. Principales dispositions Vérification périodique obligatoire : Tous les instruments de mesure doivent être vérifiés. Un marquage spécifique est requis : soit la marque "mX", soit une étiquette de validité. Lieux et modalités de vérification : Les vérifications se déroulent soit dans les locaux de l’Agence Nationale de Métrologie (ANM), soit sur les sites des entreprises détentrices des instruments. Des bureaux fixes et temporaires, organisés par les directions régionales du commerce, seront mis en place selon un calendrier préétabli (voir tableau "A" annexé). Responsabilités des détenteurs d’instruments : Assurer la précision et le bon fonctionnement des instruments en effectuant des contrôles statistiques périodiques sur les poids ou volumes des matières mesurées. Tenir un registre des résultats de ces contrôles, à présenter aux inspecteurs en cas de demande. Dispositions spécifiques pour les distributeurs de carburant : Les équipements fixes des stations-service feront l’objet de vérifications selon des périodes définies (voir tableau "B" annexé). Normes métrologiques des instruments : Les instruments utilisés pour les contrôles statistiques doivent respecter des exigences spécifiques détaillées dans le tableau "C" annexé. Application et publication Cette décision est publiée au JORT n°150 du 13 décembre 2024 et entre en vigueur immédiatement pour l’organisation des opérations de contrôle en 2025. Conclusion : Tous les acteurs concernés (entreprises, institutions publiques et distributeurs) doivent se conformer à ces obligations pour garantir la conformité légale et métrologique de leurs instruments.


==================================================

Application:
QUALITÉ

Theme:
Unités de mesures 

Type:
Décret

Numero:
2001-1936

Date:
2001-08-14

Titre:
Relatif aux unités de mesure légales

Resume:
- Article premier : Le présent décret fixe : * Les dénominations, les définitions et les symboles des unités de mesures légales mentionnées à l'article 3 de la loi relative à métrologie légale. * La formation des multiples et sous-multiples décimaux des unités légales. * Les éléments nécessaires à l'établissement, à la production, à la conservation et à la réalisation des étalons nationaux qui représentent celles des unités de mesures pouvant être matérialisées. * Les prescriptions nécessaires à l'établissement et à la publication des règles qui permettent de produire les unités de mesures ne pouvant par être matérialisées.


==================================================

Application:
QUALITÉ

Theme:
Unités de mesures 

Type:
Décret gouvernemental

Numero:
2019-475

Date:
2019-05-28

Titre:
Modifiant le décret n°1036-2001 relatif à la fixation des méthodes de contrôle métrologique légal

Resume:
Modifiant le décret n°1036-2001 relatif à la fixation des méthodes de contrôle métrologique légal et les caractéristiques des signes de contrôle et les conditions de les poser sur les outils de mesure Un résumé illustrant les principales exigences applicables sera présenté dès que la version française sera publiée


==================================================

Application:
QUALITÉ

Theme:
Etalonnage

Type:
Arrêté

Numero:
06-01-2017

Date:
2017-01-06

Titre:
Les opérations de vérification et de poinçonnage des instruments de mesure au cours de l’année 2017.

Resume:
- Article premier : La vérification périodique et obligatoire des instruments de mesure au cours de l’année 2017, sera constatée par l’apposition d’une marque portant la lettre arabe "? "suivie immédiatement par la lettre (U) ou par l’apposition d’une vignette comportant la validité du poinçonnage. - Article 2 : La vérification périodique aura lieu soit dans les locaux de l’agence nationale de métrologie, soit dans les établissements où sont détenus les instruments de mesure. - Article 3 : Les détenteurs d’instruments de remplissage, de distribution ou de pesage à fonctionnement automatique doivent surveiller l’exactitude et le bon fonctionnement de leurs instruments, et ce, en effectuant périodiquement un contrôle statistique pondéral ou volumétrique sur les produits mesurés. Les résultats des essais seront consignés dans des registres réservés à cet effet. Ces registres doivent être présentés à la première demande aux agents chargés du contrôle et du poinçonnage. Les instruments servant au contrôle statistique doivent avoir les caractéristiques métrologiques appropriées, conformément au tableau « C » annexé au présent arrêté.


==================================================

Application:
QUALITÉ

Theme:
Métrologie

Type:
Arrêté

Numero:
19-01-2000

Date:
2000-01-19

Titre:
Relatif aux opérations de vérification et de poinçonnage des instruments de mesures au cours de l’année 2000

Resume:
La vérification périodique et obligatoire des instruments de mesure sera constatée par l’apposition du poinçon portant la lettre arabe « ? » suivie immédiatement par la marque de vérification de l'année 2000 portant la lettre « S », dont ce présent arrête fixe la listes des instruments obligatoirement soumis à cette vérification, ainsi le lieu de la vérification pour chaque catégories des instruments. Est annexé au présent arrêté, un tableau "A" qui indique le fonctionnement des bureaux temporaires dans les régions au cours de l'année 2000, Un tableau "B" qui contient la liste des tournée de vérification des distributeurs de carburant à installation fixe et un tableau "C" qui a pour objet de fixer les caractéristiques métrologiques des instruments de pesage utilisés pour le contrôle des produits préemballées.


==================================================

Application:
QUALITÉ

Theme:
Poinçonnage des instruments de mesure

Type:
Décret

Numero:
2013-1220

Date:
2013-02-26

Titre:
Relatif aux opérations de vérification et poinçonnage des instruments de mesure

Resume:
La vérification périodique et obligatoire des instruments de mesure au cours de l'année 2013 sera constatée : - soit par l'apposition d'une marque portant la lettre arabe " ? " suivie immédiatement par la lettre (V) - soit par l'apposition d'une vignette comportant la validité du poinçonnage. Les détenteurs d'instruments de remplissage, de distribution ou de pesage à fonctionnement automatique doivent surveiller l'exactitude et le bon fonctionnement de leurs instruments, et ce, en effectuant périodiquement un contrôle statistique pondéral ou volumétrique sur les produits mesurés. Les résultats des essais seront consignés dans des registres réservés à cet effet. Ces registres doivent être présentés à la première demande aux agents chargés du contrôle et du poinçonnage.


==================================================

Application:
QUALITÉ

Theme:
Poinçonnage des instruments de mesure

Type:
Arrêté

Numero:
06-04-1995

Date:
2017-04-10

Titre:
Relatif aux opérations de vérification et de poinçonnage des poids et mesures au cours de l'année 1995

Resume:
La vérification périodique et obligatoire des instruments de mesure sera constatée au cours de l'année 1995 par l'apposition d'un poinçon portant la lettre "L", dont ce présent arrête fixe la listes des instruments obligatoirement soumis à cette vérification, ainsi le lieu de la vérification pour chaque catégories des instruments. Est annexé au présent arrêté, un tableau "A" qui indique le fonctionnement des bureaux temporaires dans les régions au cours de l'année 1995, Un tableau "B" qui à pour objet de fixer les dates des opérations de vérifications effectuées dans les établissements où sont détenus les instruments de pesage et de mesurage qui se dérouleront aux dates convenues entre le service de la métrologie légale et les établissements concernés à l'exception des distributeurs de carburant, et un tableau "C" qui contient la liste par gouvernorat des réparateurs d'instruments de pesage autorisés à participer aux tournées de vérification de poids et mesures.


==================================================

Application:
QUALITÉ

Theme:
Poinçonnage des instruments de mesure

Type:
Arrêté

Numero:
08-04-1996

Date:
1996-04-18

Titre:
Relatif aux opérations de vérification et de poinçonnage des instruments de mesure au cours de l'année 1996

Resume:
La vérification périodique et obligatoire des instruments de mesure sera constatée au cours de l'année 1996 par l'apposition d'un poinçon portant la lettre "L", dont ce présent arrête fixe la listes des instruments obligatoirement soumis à cette vérification, ainsi le lieu de la vérification pour chaque catégories des instruments. Est annexé au présent arrêté, un tableau "A" qui indique le fonctionnement des bureaux temporaires dans les régions au cours de l'année 1996, Un tableau "B" qui à pour objet de fixer les dates des opérations de vérifications effectuées dans les établissements où sont détenus les instruments de pesage et de mesurage qui se dérouleront aux dates convenues entre le service de la métrologie légale et les établissements concernés à l'exception des distributeurs de carburant, et un tableau "C" qui contient la liste par gouvernorat des réparateurs d'instruments de pesage autorisés à participer aux tournées de vérification de poids et mesures.


==================================================

Application:
QUALITÉ

Theme:
Poinçonnage des instruments de mesure

Type:
Arrêté

Numero:
12-12-2007

Date:
2007-12-12

Titre:
Relatif aux opérations de vérification et de poinçonnage des instruments de mesures au cours de l’année 2008 

Resume:
- Article premier : La vérification périodique et obligatoire des instruments de mesure au cours de l’année 2008 sera constatée par l’apposition d’une marque portant la lettre arabe « ? » suivie immédiatement par la lettre « H ». - Article 2 : La vérification périodique a lieu soit dans les locaux des services de la métrologie légale, soit dans les bureaux temporaires de vérification établis à l’occasion des tournées de vérification, soit dans l’établissement où sont détenus les instruments de mesure. Les opérations de vérification s’effectueront, d’une façon continue, dans les bureaux permanents de poinçonnage relevant des Directions Régionales du Commerce. En dehors des chefs lieux des gouvernorats, les opérations de vérification se dérouleront, selon les dates indiquées au tableau « A » annexé au présent arrêté, dans les bureaux temporaires établis dans les localités. Les opérations de vérification effectuées dans les établissements où sont détenus les instruments de mesurage se dérouleront aux dates convenues entre le service de la métrologie légale et les établissements concernés, à l’exception des distributeurs de carburant fixes dont les dates sont indiquées dans le tableau « B » annexé au présent arrêté. - Article 3 : Les détenteurs d’instruments de remplissage, de distribution ou de pesage à fonctionnement automatique doivent surveiller l’exactitude et le bon fonctionnement de leurs instruments, et ce, en effectuant périodiquement un contrôle statistique pondérale ou volumétrique sur les produits mesurés.


==================================================

Application:
QUALITÉ

Theme:
Poinçonnage des instruments de mesure

Type:
Arrêté

Numero:
14-02-2007-1

Date:
2007-02-14

Titre:
Relatif aux opérations de vérification et de poinçonnage des instruments de mesures au cours de l’année 2007

Resume:
- Article premier : La vérification périodique et obligatoire des instruments de mesure au cours de l’année 2007 sera constatée par l’apposition d’une marque portant la lettre arabe « ? ». - Article 2 : Les opérations de vérification effectuées dans les établissements où sont détenus les instruments de mesurage se dérouleront aux dates convenues entre le service de la métrologie légale et les établissements concernés, à l’exception des distributeurs de carburant fixes dont les dates sont indiquées dans le tableau « B » annexé au présent arrêté. - Article 3 : Les instruments servant au contrôle statistique doivent avoir les caractéristiques métrologiques appropriées, conformément au tableau « C » annexé au présent arrêté.


==================================================

Application:
QUALITÉ

Theme:
Poinçonnage des instruments de mesure

Type:
Arrêté

Numero:
23-11-2009

Date:
2009-11-23

Titre:
Relatif aux opérations de vérification et de poinçonnage des instruments de mesure au cours de l'année 2010

Resume:
Article premier - La vérification périodique et obligatoire des instruments de mesure au cours de l'année 2010 sera constatée par l'apposition d'une marque portant la lettre arabe "?" suivie immédiatement par la lettre (D), dont ce présent arrête fixe la listes des instruments obligatoirement soumis à cette vérification, ainsi le lieu de la vérification pour chaque catégories des instruments. Est annexé au présent arrêté, un tableau "A" qui indique le fonctionnement des bureaux temporaires dans les régions au cours de l'année 2010, Un tableau "B" qui contient la liste des tournée de vérification des distributeurs de carburant à installation fixe et un tableau "C" qui a pour objet de fixer les caractéristiques métrologiques des instruments de pesage utilisés pour le contrôle des produits préemballées.


==================================================

Application:
QUALITÉ

Theme:
Poinçonnage des instruments de mesure

Type:
Arrêté

Numero:
26-12-2002

Date:
2002-12-26

Titre:
Relatif aux opérations de vérification et de poinçonnage des instruments de mesure au cours de l'année 2003

Resume:
- Article premier : La vérification périodique et obligatoire des instruments de mesure au cours de l'année 2003 sera constatée par l'apposition d'une marque portant la lettre arabe "?" suivie immédiatement par la lettre (V), dont ce présent arrête fixe la listes des instruments obligatoirement soumis à cette vérification, ainsi le lieu de la vérification pour chaque catégories des instruments. Est annexé au présent arrêté, un tableau "A" qui indique le fonctionnement des bureaux temporaires dans les régions au cours de l'année 2003, Un tableau "B" qui contient la liste des tournée de vérification des distributeurs de carburant à installation fixe et un tableau "C" qui a pour objet de fixer les caractéristiques métrologiques des instruments de pesage utilisés pour le contrôle des produits préemballées.


==================================================

Application:
QUALITÉ

Theme:
Poinçonnage des instruments de mesure

Type:
Arrêté

Numero:
15-12-2008

Date:
2008-12-15

Titre:
Relatif aux opérations de vérification et de poinçonnage des instruments de mesure au cours de l’année 2009

Resume:
- Article premier : La vérification périodique et obligatoire des instruments de mesure au cours de l’année 2009 sera constatée par l’apposition d’une marque portant la lettre arabe «  » suivie immédiatement par la lettre (N).


==================================================

Application:
QUALITÉ

Theme:
Poinçonnage des instruments de mesure

Type:
Arrêté

Numero:
11-12-2018

Date:
2018-12-11

Titre:
Relatif aux opérations de vérification et de poinçonnage des instruments de mesure au titre de l'année 2019

Resume:
- Article premier : La vérification périodique et obligatoire des instruments de mesure au cours de l'année 2019 sera constatée par l'apposition d'une marque portant la lettre arabe "? "suivie immédiatement par la lettre (C) ou par l'apposition d'une vignette comportant la validité du poinçonnage.


==================================================

Application:
QUALITÉ

Theme:
Poinçonnage des instruments de mesure

Type:
Arrêté

Numero:
12-12-2019

Date:
2019-12-12

Titre:
Relatif aux opérations de vérification et de poinçonnage des instruments de mesure au titre de l'année 2020

Resume:
Relatif aux opérations de vérification et de poinçonnage des instruments de mesure au titre de l'année 2020


==================================================

Application:
QUALITÉ

Theme:
Poinçonnage des instruments de mesure

Type:
Arrêté

Numero:
01-02-2017

Date:
2017-02-01

Titre:
l'obtention du certificat de formation pour la conduite des véhicules destinés au transport des matières dangereuses par route

Resume:
- La vérification périodique obligatoire des instruments de mesure au cours de l’année 2021 sera constatée par l’apposition d’une marque portant la lettre arabe "? "suivie par la lettre (R) ou par l’apposition d’une vignette comportant la validité du poinçonnage soit dans les locaux de l’agence nationale de métrologie, soit dans les établissements où sont détenus les instruments de mesure. - Les détenteurs d’instruments de remplissage ou de pesage à fonctionnement automatique sont tenus de surveiller l’exactitude et le bon fonctionnement de leurs instruments en effectuant périodiquement un contrôle statistique pondéral ou volumétrique sur les produits préemballés, dont les résultats seront consignés dans des registres et doivent être présentés à la première demande aux agents chargés du contrôle et du poinçonnage.


==================================================

Application:
QUALITÉ

Theme:
L'auto-homologation

Type:
Décret

Numero:
70-545

Date:
1970-10-24

Titre:
Relatif aux prix de revient et aux prix de vente des marchandises soumises à auto-homologation

Resume:
Les prix de revient aux stades de la distribution, des produits et marchandises fabriqués ou transformés localement ou d'importation, sont déterminés à partir des éléments limitativement énumérées, dans ce présent décret, et qu doivent être justifiés par des factures reprécisées, lettres de voitures, bordeaux de frais ou autres documents comptables.


==================================================

Application:
QUALITÉ

Theme:
Dispositions administratives

Type:
Décret

Numero:
2009-292

Date:
2008-02-02

Titre:
Le domaine d’application de l’avance sur la taxe de  formation professionnelle

Resume:
Décret n° 2009-292 du 2 février 2009, fixant le domaine d’application de l’avance sur la taxe de formation professionnelle, son taux, les conditions et les modalités de son bénéfice, ainsi que le domaine d’application, les modalités et les conditions de bénéfice des droits de tirage. Chapitre 2 : Le domaine d’application, le taux, les conditions et les modalités du bénéfice de l’avance sur la taxe de formation professionnelle - Article 2 : Les entreprises soumises à la taxe de formation professionnelle, dont le montant annuel de la taxe de formation professionnelle due au titre de l’année précédant l’année de réalisation des actions de formation est supérieur ou égal à mille dinars, bénéficient de l’avance sur la taxe de formation professionnelle mentionnée à l’article 31 (nouveau) de la loi n° 88-145 du 31 décembre 1988 relative à la loi de finances pour l’année 1989 telle que modifiée par la loi n° 2007-69 de 27 décembre 2007, relative à l’initiative économique. - Article 3 : Le taux maximum de l’avance sur la taxe de formation professionnelle est fixé à 60 % de la taxe due au titre de l’année précédente. Chapitre 3 : Le domaine d’application, les conditions et les modalités du bénéfice des droits de tirage - Article 13 : Le système des droits de tirage a pour objet de permettre aux entreprises économiques privées mentionnées ci-après de bénéficier d’un financement direct de la part de l’Etat au titre d’activités de formation réalisées au profit de ses agents, en contrepartie de sa contribution à la formation initiale : - les entreprises dont le montant annuel de la taxe de formation professionnelle due est inférieur à mille dinars, - les entreprises dont le montant annuel de la taxe de formation professionnelle due est supérieur ou égal à mille dinars et qui n’ont pas utilisé le droit à l’avance, - les entreprises qui ont épuisé l’utilisation de l’avance sur la taxe de formation professionnelle, - les entreprises exonérées de la taxe de formation professionnelle, - les entreprises non soumises à la taxe de formation professionnelle conformément à la législation en vigueur, - les artisans et les entreprises de métiers. - Article 14 : Le financement dans le cadre du système des droits de tirage se limite aux activités de formation ci-après : - les études et consultations en formation, - la formation continue en Tunisie dans un cadre individuel ou collectif, - les actions collectives réalisées dans le cadre du partenariat avec les organisations professionnelles, - les actions de validation des acquis de l’expérience. - Article 15 : Le montant maximum des droits de tirage est égal au montant total des dépenses en formation initiale réalisées l’année précédant l’année durant laquelle a été déposée la demande de bénéfice des droits de tirage. Les montants maximum des utilisations des droits de tirage au titre du financement des activités de formation mentionnées à l’article 14 ci-dessus sont fixés par l’arrêté mentionné à l’article 5 du présent décret.


==================================================

Application:
QUALITÉ

Theme:
Dispositions administratives

Type:
Décret

Numero:
2009-3381

Date:
2009-11-02

Titre:
Fixation du domaine d'application de l'avance sur la taxe de formation professionnelle

Resume:
Fixation du domaine d'application de l'avance sur la taxe de formation professionnelle, son taux, les conditions et les modalités de son bénéfice, ainsi que le domaine d'application, les modalités et les conditions de bénéfice des droits de tirage. - Article 17 bis : La commission instituée en vertu des dispositions, de l' article 17 du présent décret est, à titre transitoire, chargée d’examiner les demandes de ristournes sur la taxe de formation professionnelle au titre des années 2008 et antérieures. - Les arrêtés relatifs aux ristournes indiquées au paragraphe premier du présent article et éventuellement aux réclamations y afférentes, sont pris par le ministre de l'emploi et de l'insertion professionnelle des jeunes, sur proposition de la commission sus-indiquée. - Ces arrêtés mentionnent notamment les montants définitifs des ristournes sur la taxe de formation professionnelle, ventilés selon la nature des actions de formation et les catégories de dépenses correspondantes. - Article 26 (paragraphe deux) : Toutefois, peuvent à titre exceptionnel, bénéficier des interventions du programme national de formation continue, les entreprises ayant présenté durant le premier trimestre de l’année 2009 des dossiers à cet effet, à titre individuel ou dans le cadre de conventions.


==================================================

Application:
QUALITÉ

Theme:
Dispositions administratives

Type:
Décret

Numero:
2014-40

Date:
2014-01-09

Titre:
 Modification du décret n° 2009-292, fixant le domaine d’application de l’avance sur la taxe de formation professionnelle

Resume:
Portant modification du décret n° 2009-292 du 02/02/2009, fixant le domaine d'application de l'avance sur la taxe de formation professionnelle, son taux, les conditions et les modalités de son bénéfice, ainsi que le domaine d'application, les modalités et les conditions de bénéfice des droits de tirage. - Article 4 (nouveau) : Les entreprises qui désirent bénéficier de l'avance sur la taxe de formation professionnelle sont tenues de commencer la déduction du montant de l'avance de la taxe susvisée à l'occasion du dépôt de la déclaration mensuelle des impôts au titre du mois de janvier de chaque année dans les délais légaux. Le non commencement de la déduction de l'avance dans les délais susvisés est considéré comme renonciation au bénéfice de l'avance d'une manière définitive et irrévocable.


==================================================

Application:
QUALITÉ

Theme:
Dispositions administratives

Type:
Décret

Numero:
2012-742

Date:
2012-07-02

Titre:
Instituant un prix national de la qualité

Resume:
- Article 2 : Le prix national de la qualité est attribué par décret pris sur proposition du ministre chargé de l'industrie, et ce, pendant le mois de novembre de chaque année, à l'occasion de l'organisation de la journée nationale de la qualité. - Article 3 : Le prix national de la qualité est attribué chaque année aux entreprises classées aux trois premiers rangs. Le montant du prix est fixé comme suit : - 20 000 dinars pour l'entreprise classée première, - 15 000 dinars pour l'entreprise classée deuxième, - 10 000 dinars pour l'entreprise classée troisième. Le montant du prix sera prélevé, chaque année, sur le budget du ministère chargé de l'industrie. - Article 4 : Il est crée un comité technique chargé d'établir chaque année une liste groupant, par ordre de mérite, les entreprises ayant le mieux mis en place un système de management par la qualité totale, et ce, conformément aux critères prévus à l'article 6 du présent décret.


==================================================

Application:
QUALITÉ

Theme:
Dispositions administratives

Type:
Arrêté

Numero:
10-02-2009

Date:
2009-02-10

Titre:
Les domaines d’utilisation de l’avance sur la taxe de formation professionnelle

Resume:
- Article premier : Les domaines d’utilisation de l’avance sur la taxe de formation professionnelle, les critères et les montants de financement des activités de formation y afférentes sont fixés dans les tableaux annexées dans ce présent arrêté.


==================================================

Application:
QUALITÉ

Theme:
Dispositions administratives

Type:
Décret gouvernemental

Numero:
2018-573

Date:
2018-06-20

Titre:
La création d'une unité de gestion  pour la réalisation du programme national de promotion de la qualité

Resume:
- Article premier : Est créé au sein du ministère de l'industrie et des petites et moyennes entreprises une unité de gestion par objectifs pour la réalisation du programme national de promotion de la qualité et de la productivité. Elle est placée sous l'autorité du ministre chargé de l'industrie. - Article 2 : Les missions de l'unité de gestion par objectifs pour la réalisation du programme national de promotion de la qualité et de la productivité sont les suivantes : • La coordination avec les centres techniques pour la réalisation des actions programmées et notamment : - la sensibilisation des opérateurs économiques tunisiens sur les méthodes de gestion de la qualité et de la productivité, - la formation d'experts, de consultants nationaux ainsi que des responsables qualité des entreprises dans les domaines liés à la qualité et à la productivité, - la programmation des actions d'assistance aux entreprises pour la mise en place des systèmes de management de la qualité et les outils d'amélioration de la productivité et le suivi de sa mise en œuvre. • L'évaluation périodique de l'avancement du programme national de promotion de la qualité et de la productivité et la proposition des mesures adéquates et efficaces pour introduire les actions correctives nécessaires jugées utiles et en générale la proposition de toute action permettant de réaliser les objectifs du programme, • l'élaboration des rapports de suivi du programme national de promotion de la qualité et de la productivité,


==================================================

Application:
QUALITÉ

Theme:
dispositions administratives liée à l'état

Type:
Arrêté

Numero:
12-12-2019

Date:
2019-12-12

Titre:
Approuvant la mise à jour des tableaux des durées de conservation des documents privés du ministère de l'industrie des PME 

Resume:
arrêté du ministère de l’industrie et des petites et moyennes entreprises du 12 décembre 2019, approuvant la mise à jour des tableaux des durées de conservation des documents privés du ministère de l'industrie des petites et moyennes entreprises.


==================================================

Application:
QUALITÉ

Theme:
dispositions administratives liée à l'état

Type:
Arrêté

Numero:
06-08-2025

Date:
2025-08-06

Titre:
Portant homologation des certificats et diplômes de formation professionnelles

Resume:
Arrêté du ministre de l’emploi et de la formation professionnelle du 6 août 2025, portant homologation, renouvellement d’homologation et prolongation d’homologation de certificats et diplômes de formation professionnelle.


==================================================

Application:
QUALITÉ

Theme:
dispositions administratives liée à l'état

Type:
Arrêté

Numero:
06-08-2025

Date:
2025-08-06

Titre:
portant prolongation d’homologation de certificats et diplômes de formation professionnelle

Resume:
Arrêté du ministre de l’emploi et de la formation professionnelle du 6 août 2025, portant prolongation d’homologation de certificats et diplômes de formation professionnelle


==================================================

Application:
QUALITÉ

Theme:
dispositions administratives liée à l'état

Type:
Arrêté

Numero:
16-09-2025

Date:
2025-09-16

Titre:
Portant publication des taux d'intérêt effectifs moyens et des seuils des taux d'intérêt excessifs correspondants

Resume:
Arrêté du 16 septembre 2025 fixant les taux d’intérêt effectifs moyens constatés au 1er semestre 2025 et les seuils des taux d’intérêt excessifs applicables au 2ème semestre 2025, pour les différentes catégories de concours bancaires (leasing, crédits, découverts, affacturage, etc.).


==================================================

Application:
QUALITÉ

Theme:
dispositions administratives liée à l'état

Type:
Arrêté

Numero:
30-12-2025

Date:
2025-12-30

Titre:
Fixant les calendriers de paiement des créances fiscales et des amendes fiscales administratives revenant à l’Etat

Resume:
L’arrêté de la ministre des Finances du 30 décembre 2025, publié au JORT n°155, fixe le calendrier officiel de paiement des créances fiscales et des amendes administratives dues à l’État pour l’année 2026, conformément à la loi n°2025-17 du 12 décembre 2025. Il précise les dates et modalités de règlement, permettant aux contribuables et entreprises de respecter leurs obligations fiscales de manière planifiée et conforme à la réglementation.


==================================================

Application:
QUALITÉ

Theme:
dispositions administratives liée à l'état

Type:
Arrêté

Numero:
19-12-2025

Date:
2025-12-19

Titre:
Portant homologation, renouvellement d’homologation et prolongation d’homologation de certificats et diplômes de formation

Resume:
Arrêté du ministre de l’emploi et de la formation professionnelle du 19 décembre 2025, portant homologation, renouvellement d’homologation et prolongation d’homologation de certificats et diplômes de formation professionnelle.


==================================================

Application:
QUALITÉ

Theme:
dispositions administratives liée à l'état

Type:
Décret gouvernemental

Numero:
2019-582

Date:
2019-05-29

Titre:
Création une unité de gestion selon les objectifs du ministère du Développement et de la Coopération internationale

Resume:
Création une unité de gestion selon les objectifs du ministère du Développement et de la Coopération internationale pour mener à bien le projet de gestion du budget de l'État et de fixation de son organisation et de ses méthodes de fonctionnement. Un résumé illustrant les principales exigences applicables sera présenté dès que la version française sera publiée


==================================================

Application:
QUALITÉ

Theme:
dispositions administratives liée à l'état

Type:
Décret gouvernemental

Numero:
811-2019

Date:
2019-09-12

Titre:
Relatif à la fixation des montant des taxes pour services rendus Du Centre national du registre des institutions et les méthode

Resume:
Article 01 : Fixation des montant des frais pour services rendus à partir de Registre national des institutions selon les annexes du présent décret.


==================================================

Application:
QUALITÉ

Theme:
dispositions administratives liée à l'état

Type:
Convention

Numero:
----

Date:
2023-06-01

Titre:
CONVENTION COLLECTIVE CADRE

Resume:
ARTICLE 13 : Bulletin de paye Lors du paiement des salaires, il sera délivré à chaque travailleur un bulletin de paye conformément aux dispositions du Code du Travail ARTICLE 43 : Apprentissage, formation et perfectionnement professionnels L'employeur s'engage, en fonction des besoins et des possibilités de l'entreprise, à favoriser l'apprentissage, la formation et le perfectionnement professionnels. L'apprentissage, la formation et le perfectionnement professionnels seront organisés conformément aux principes prévus par la loi d'orientation de la formation professionnelle et la législation en vigueur. L'employeur peut - le cas échéant - organiser la formation continue au profit des travailleurs en vue de leur perfectionnement professionnel et ce par tous les moyens qu'il jugera les plus efficaces, efficients et adaptés et ce en collaboration avec la commission consultative de l'entreprise. Les programmes de formation seront déterminés au niveau des secteurs. Article 44 : Les tenues de travail et de protection et à l'hygiéne et sécurité : Les vêtements et les chaussures du travail sont à la charge de l’employeur. Il est tenu également de : -Mettre à la disposition des employés les vêtements de protection. -Aménager les locaux dans un état sanitaire répondant à toutes les conditions d'hygiène et de sécurité, et ce en mettant à la disposition des employés des lavabos, des douches, des toilettes et des vestiaires. Un local (réfectoire, cantine) sera aménagé pour permettre au personnel d'y passer la coupure entre les deux séances de travail, s'ils ne rentrent pas chez eux, dont il peut être utilisé aussi pour les réunions syndicales s'il est approprié pour ce genre de réunions et indépendant des lieux de production et de stockage. Article 46 : Relative à la médecine du travail relatif à la boite de premiers soins : Procédure: L'entreprise doit mettre à dispostion des travailleurs une boite de premiers soins selon une liste de médicaments fixée au préalable par le medecin du travail


==================================================

Application:
QUALITÉ

Theme:
dispositions administratives liée à l'état

Type:
Cahier des conditions d'éligibilité

Numero:
01

Date:
N/A

Titre:
Création et fonctionnement des structures de formation privée 

Resume:
Article 05 : Chaque structure particulière de formation doit déposé auprès de la Direction régionale de la formation professionnelle et de l'emploi. territorialement compétent, et avant de commencer l'activité, une déclaration écrite conformément au formulaire d'accompagnement, accompagnée d'une copie du Ces conditions sont signées par la partie émettrice de la structure, qui reçoit en retour l'agrement Article 06 : La structure privée de formation doit avoir un agrément. Le personnel d'encadrement est qualifié à cet effet par les services compétents, chacun dans son domaine d'intervention. Article 09 : Il est exigé que le personnel chargé de la formation possède les qualités morales et professionnelles nécessaires. Article 12 : Les structures particulières de formation en matière de couverture sociale et de santé et sécurité professionnelle sont soumises à Sur le plan procédural et procédural, il suit la législation et la réglementation en vigueur. Article 33 : il est tenu de tenir à sa disposition tous les documents administratifs, techniques et pédagogiques requis, notamment : - Les documents administratifs liés à la structure, à son propriétaire et à son gestionnaire, - MMF Mknif, - Dossiers administratifs et pédagogiques pour le stage d'été, - Records de fréquentation, - Livres du département, - Horaires des stagiaires et stagiaires, - Conférencier des séances du conseil pédagogique, - Procès-verbaux des séances pour examens secs. Article 34 : La structure particulière de formation doit fournir annuellement un rapport statistique sur l'activité de formation réalisée. Au cours de l'année écoulée en termes de spécialisations, de leurs niveaux, du nombre de stagiaires et des services fournis sous le titre du chapitre 26 de ce cahier des charges, selon un modèle émis par le ministère de la Formation professionnelle et de l'Emploi. Cette déclaration est adressée à l'administration régionale compétente pour la formation professionnelle et l'emploi avant le 31 mars de chaque année. Une annee.


==================================================

Application:
QUALITÉ

Theme:
N/A

Type:
Arrêté

Numero:
05-03-2019

Date:
2019-08-05

Titre:
L'identification des  informations fournies par les intérêts de recouvrement du Registre national des sociétés et les modalités

Resume:
Un résumé illustrant les principales exigences sera affiché dès que la version française sera publiée


==================================================

Application:
QUALITÉ

Theme:
N/A

Type:
Décret gouvernemental

Numero:
228-2019

Date:
2019-03-05

Titre:
Modifiant et complétant le décret n°292-2009, fixant le domaine d’application de l’avance sur la taxe de formation pro*

Resume:
Un résumé illustrant les principales exigences sera affiché dès que la version française sera publiée


==================================================

Application:
SÉCURITÉ

Theme:
Autorisation d'exploitation

Type:
Décret

Numero:
1368-97

Date:
1997-07-24

Titre:
Relatif au régime fiscal des produits relevant des numéros 22 à 22-08 du tarif des droits de douane

Resume:
ARTICLE 19 : Les entrepositaires d'alcools destinés à la fabrications 4des boissons alcoolisées, des alc000ls destinés à la fabrication de produits pharmaceutiques, des parfums, du vinaigre et des alcools à usage industriel et ménager, doivent avant le commencement de leur activité, obtenir une autorisation préalable du bureau de contrôle des impôts compétent pour ouvrir un entrepôt d'alcool. ARTICLE 28 : Les fabricants de boissons alcoolisées doivent tenir un registre de comptabilité matière côté et paraphé par le bureau de contrôle des impôts compétent, sur lequel sont inscrits au jour le jour sans blanc, ni rature, ni surcharge : 1- aux entrées : - les quantités d'alcool acquises appuyées par les congés ; - les quantités de préparations alcooliques destinées à la fabrication des boissons alcoolisées appuyées par les congés. 2- aux sorties : - les quantités de boissons alcoolisées livrées,''par type de produits appuyées par les factures de ventes et les congés; - les quantités de boissons alcoolisées manquantes.


==================================================

Application:
SÉCURITÉ

Theme:
Autorisation d'exploitation

Type:
Arrêté

Numero:
6 Septembre 2012

Date:
2012-09-25

Titre:
Conditions d'aménagement et d'exploitation des établissement classés de la 3éme catégories  

Resume:
Le présent arrété fixent les conditions d'aménagement et d'exploitation des établissement classés de la 3éme catégories :


==================================================

Application:
SÉCURITÉ

Theme:
Autorisation d'exploitation

Type:
Arrêté

Numero:
article 5 

Date:
2012-09-06

Titre:
L'exploitant doit tenir dans l'établissement un dossier mis à jour

Resume:
Art. 5 - L'exploitant doit tenir dans l'établissement un dossier mis à jour comportant les documents suivants : une copie du dossier sur la base duquel l'autorisation a été accordée, les plans mis à jour de l'établissement et de ses installations, - l'arrêté d'autorisation, une attestation de prévention valable, les textes législatifs et réglementaires relatifs aux établissements classés, les certificats d'épreuves et les rapports du contrôle technique de différentes installations et appareils délivrés par des organismes de contrôle agréés par le ministre chargé de l'industrie. Ce dossier doit être tenu à la disposition des inspecteurs des établissements classés à chaque demande.


==================================================

Application:
SÉCURITÉ

Theme:
Autorisation d'exploitation

Type:
Arrêté

Numero:
article 15 

Date:
2012-09-06

Titre:
Les installations électriques doivent être réalisées conformément au décret n° 75-503 du 28 Juillet 1975

Resume:
Art. 15 - Les installations électriques doivent être réalisées conformément au décret n° 75-503 du 28 Juillet 1975, portant réglementation des mesures de protection des travailleurs dans les établissements qui mettent en œuvre des courants électriques. L'installation électrique et le matériel utilisé doivent être appropriés aux risques inhérents aux activités de l'établissement. En outre l'installation et le matériel important pour la sécurité doivent être maintenus en bon état de fonctionnement.


==================================================

Application:
SÉCURITÉ

Theme:
Autorisation d'exploitation

Type:
Arrêté

Numero:
article 24

Date:
2012-09-06

Titre:
Gestion des produits dangereux : Documentation et étiquetage conformes

Resume:
Art. 24 : L'exploitant doit tenir dans l'établissement des documents lui permettant de connaître la nature et les risques des produits dangereux présents dans l'établissement et particulier leurs fiches de données de sécurité. Tous les récipients doivent porter en caractères très lisibles le nom des produits qu'ils contiennent et des étiquettes mentionnant leur type de danger conformément à la réglementation relative aux produits dangereux.


==================================================

Application:
SÉCURITÉ

Theme:
Autorisation d'exploitation

Type:
Arrêté

Numero:
article 34

Date:
2012-09-06

Titre:
Gestion des déchets : Stockage sécurisé et prévention des risques

Resume:
Art. 34 - Les déchets produits par l'établissement sont stockés, en attendant leur enlèvement dans des conditions limitant les risques de pollution (les envols, les infiltrations dans le sol, les odeurs...). Les mesures nécessaires doivent être prises pour protéger les déchets des pluies. Les déchets constitués ou imprégnés de produits inflammables, dangereux ou toxiques seront conservés en attendant leur enlèvement dans des récipients clos et étanches. Des extincteurs et des moyens de neutralisation des risques inhérents à chaque type de déchet doivent être mis à proximité de ces récipients.


==================================================

Application:
SÉCURITÉ

Theme:
Autorisation d'exploitation

Type:
Arrêté

Numero:
article 51 

Date:
2012-09-06

Titre:
Prévention des incendies : Permis de feu et contrôle des zones à risque

Resume:
Art. 51 Il est interdit d'allumer le feu sous une forme quelconque dans les parties de l'établissement présentant des risques d'incendie ou d'explosion, sauf pour la réalisation de travaux ayant fait l'objet d'un Le > dans les zones prévues par les articles 49, 50 et du premier paragraphe premier du présent article doivent être établis et approuvés par l'exploitant ou par la personne qu'il désigne nommément. Lorsque les travaux sont effectués dans ces zones par une entreprise extérieure, le « permis de feu >> et les consignes particulières relatives à la sécurité de l'établissement, doivent être approuvés par l'exploitant et l'entreprise extérieure ou les personnes qu'ils auront nommément désignées. Après la fin des travaux et avant la reprise de l'activité, une vérification des installations et des équipements doit être effectuée par l'exploitant ou son représentant.


==================================================

Application:
SÉCURITÉ

Theme:
Autorisation d'exploitation

Type:
Arrêté

Numero:
article 53

Date:
2012-09-06

Titre:
Attestation de prévention

Resume:
Art. 53 - L'exploitant doit obtenir l'attestation de prévention prévue à l'article 46 de la loi n° 2009-11 du 2 mars 2009, portant promulgation du code de la sécurité et de la prévention des risques d'incendie, d'explosion et de panique dans les bâtiments. Cette attestation est délivrée par la direction régionale de l'office national de la protection civil et renouvelée chaque deux ans conformément à la loi susvisée.


==================================================

Application:
SÉCURITÉ

Theme:
Autorisation d'exploitation

Type:
Arrêté

Numero:
article 26 

Date:
2012-09-06

Titre:
Circulation des véhicules

Resume:
Art. 26 L'accès des véhicules ou des engins est interdit sauf s'il est autorisé par l'exploitant. Les véhicules ou les engins de transport des produits dangereux doivent répondre aux règles techniques fixées par la réglementation relative au transport des matières dangereuses par les routes. La vérification de cette conformité est effectuée par un agent qualifié à cet effet. Toutes les opérations de vérification sont enregistrées dans un registre maintenu au moins une année pour chaque véhicule. L'exploitant fixe les règles de circulation applicables à l'intérieur de l'établissement. Ces règles seront portées à la connaissance des intéressés par des moyens appropriés (panneaux de signalisation, feux, marquages au sol, consignes écrites et affichées). Des mesures appropriées doivent être prises pour éviter que des véhicules ou engins quelconques puissent heurter ou endommager des installations, réservoirs ou leurs annexes.


==================================================

Application:
SÉCURITÉ

Theme:
Exploitation d'un établissement classé sans autorisation

Type:
Décret gouvernemental

Numero:
417-2018

Date:
2018-05-11

Titre:
La liste exclusive des activités économiques soumises à l'autorisation et la liste des licences administratives

Resume:
Titre : Concernant la publication de La liste exclusive des activités économiques soumises à l'autorisation et la liste des licences administratives pour l'exécution d'un projet et la détermination des dispositions pertinentes et les simplifier. - Article 2 : * L'approbation préalable accordée par l'autorité administrative à sa demande si elle remplit les conditions légales requises pour l'exercice de l'activité économique ou pour la réalisation d’un projet. * Autorité compétente: le Banque centrale de la Tunisie et la Comité des autorisations de la Banque centrale de la Tunisie, promulguée par la loi n ° 48 de 2016, mentionnée ci-dessus, l’organisme des marchés des capitaux et l’organisme auquel la loi confère des pouvoirs de modification pour un secteur particulier. - Article 3 : Nécessite l'exercice des activités économiques couvertes par les secteurs suivants et prévues à l'annexe 1 du présent arrêté sont soumises à l'autorisation préalable de l'autorité administrative compétente: - Matériaux naturels et matériaux de structure - Transport terrestre, maritime et aérien, - Banque, Finance, Assurance, le marché financier, - Industries dangereuses ou contaminées, - la santé, - l’Education, - la communication, - Quelques activités et des services. L'annexe 1 du présent décret gouvernemental définie la liste détaillée des activités économiques dans les secteurs susmentionnés requises pour l'obtention d'une autorisation, conditions et procédures pertinentes. Les activités économiques non visées à l'annexe 1 ne sont pas soumises à . L'annexe 1 du présent décret gouvernemental énonce la liste détaillée des activités économiques dans les secteurs susmentionnés requises pour l'obtention d'une autorisation, conditions et procédures pertinentes. Les activités économiques non visées à l'annexe 1 ne sont pas soumises aux autorisations. Chapitre 4 : Ajuste La liste des activités économiques dont les autorisations d’exercer dans l’annexe 2 doivent être établies reste en vigueur jusqu’à ce qu’elles soient valables pour une période de six (6) mois à compter de la date de son entrée en vigueur. Les autorités administratives compétentes peuvent, dans un délai maximum de six (6) mois mentionné ci-dessus, soumettre les activités économiques énoncées à l'annexe 2 du présent arrêté à la délivrance de conditions par décision conjointe de l'autorité désignée et du ministre responsable de l'investissement. Chapitre 5 La liste détermine les autorisations administratives pour la réalisation du projet et les conditions d’attribution prévues par la législation et l’arrangement en vigueur à la date de publication du présent ordre gouvernemental à l’annexe n ° 3 du présent décret gouvernemental.


==================================================

Application:
SÉCURITÉ

Theme:
Prévention des risques industriels et technologiques

Type:
Décret

Numero:
2004-956

Date:
2004-04-13

Titre:
La composition, les attributions et les modalités d fonctionnement du comité spécial des établissements classés 

Resume:
- Article 1 : 1) Fixation de la composition du comité spécial des établissements dangereux, insalubres ou incommodes. - Article 2 : Le comité assume un rôle consultatif d'assistance à la prise des décisions, il donne son avis à propos : - des textes législatifs et réglementaires relatifs aux établissements dangereux, insalubres ou incommodes, - du classement des établissements dangereux, insalubres ou incommodes, - des arrêtés d'autorisation d'ouverture et de fermeture de ces établissements. 3) Le comité se réunit sur convocation de son président quatre fois par an au moins et chaque fois que nécessaire 4) Les procès-verbaux des réunions du comité sont consignés dans un registre tenu par la direction de la sécurité au ministère de l'industrie et de l'énergie qui assure le secrétariat du comité


==================================================

Application:
SÉCURITÉ

Theme:
Prévention des risques industriels et technologiques

Type:
Décret

Numero:
2006-2687

Date:
2006-10-09

Titre:
Procédures d’ouverture et d’exploitation des établissements dangereux, insalubres ou incommodes 

Resume:
Le texte précise les procédures d’ouverture et d’exploitation des établissements classés, notamment la constitution du dossier de demande d’ouverture ou de régularisation et la taxe initiale à payer. Pour les établissements de catégorie 1 et 2, une étude des dangers et une étude d’impact sont indispensables. De même qu’un Plan d'Opération Interne avant le démarrage. Le délai limite de régularisation des dossiers des établissements en cours d’exploitation est fixé au 31 décembre 2007. * Obligations d’avoir une autorisation d’exploitation auprès de ministère de l’industrie et de l’énergies et PME * Un dossier devra être déposé au gouvernorat de Sfax qui comporte les pièces suivantes : - Une étude de dangers en quatre exemplaires exposant les éventuels dangers et fixant les mesures et les moyens de prévention contre les risques d’incendie, d’explosion, de panique et des accidents industriels majeurs. L’étude des dangers est réalisée sous la responsabilité de l’exploitant et doit contenir les éléments indispensables pour l’élaboration d’un plan d’opération interne qui doit être achevé au commencement de l’exploitation de l’établissement, - Une étude d'impact environnement en 2 exemplaires - Une note relative à la maîtrise des exigences d’hygiène, de santé et de sécurité - Un plan de masse à l'échelle 1/1000 - Un extrait de la carte de Tunisie à l’échelle 1/25000 ou 1/50000 - un récépissé du mondât postal de 50 dt au nom du receveur économe de l'imprimerie officielle - Un récépissé du mandat de 50 dt de versement du droit fixe exigible au titre de l’ouverture d'un établissement classé au profit de la Trésorerie Générale.


==================================================

Application:
SÉCURITÉ

Theme:
Prévention des risques industriels et technologiques

Type:
Décret

Numero:
68-88

Date:
1968-03-28

Titre:
Relatif aux établissements dangereux, insalubres, ou incommodes

Resume:
- Article 1 : Demandes d'autorisation Toute demande d'ouverture d'un établissement dangereux, insalubre ou incommode doit être adressée à l'ingénieur, chef de la division des industries chimiques (Secrétariat d'Etat au Plan et à l'Economie Nationale) et, à peine de nullité, satisfaire aux conditions suivantes: Identité,Emplacement, Description des installations, Etude des impacts et des dangers A ce plan sont joints des notices, légendes ou descriptions et au besoin des dessins ou croquis établis de façon à permettre de se rendre compte, d'autre part, si les dispositions matérielles projetées obvient efficacement aux inconvénients que pourraient présenter l'établissement,soit pour la sécurité, la salubrité ou la commodité du voisinage,soit pour la santé publique ou pour l'agriculture,d'autre part, si des dispositions répondent aux prescriptions édictées pour l'hygiène et la sécurité du personnel. Le mode et les conditions d'évacuation, d'utilisation et de traitement des eaux résiduaires, ainsi que des déchets et résidus de l'exploitation sont dans tous les cas spécifiés et précisés. Suivant la nature de l'industrie, l'indication des conditions d'apport à l'établissement des matières destinées à y être traitées peut aussi être exigée Plan des abords Un plan sommaire sur papier calque et à l'encre de chine dessiné à l'échelle de 1 mm/m, reproduisant l'état général des propriétés, maisons d'habitations, routes, chemins, cours d'eau, puits, égouts, etc. ... aux abords de l'emplacement projeté dans un rayon de 500 mètres pour les établissements de 1 ère classe, 200 mètres pour ceux de la 2 ème classe et 50 mètres pour ceux de la 3ème classe.Sur ce plan sont indiqués spécialement les hôpitaux ou hospices, les bâtiments publics, les écoles, les gares, dépôts. Toutefois, S'il s'agit d'un établissement de la 3 ème catégorie le demandeur n'aura à produire que le plan prévu au paragraphe précédent, ainsi qu'un croquis d'ensemble à l'échelle approximative de 5mm/m, accompagné de légendes et au besoin de descriptions matérielles de l'établissement indiquant l'affectation de constructions et terrains le joignant immédiatement.


==================================================

Application:
SÉCURITÉ

Theme:
Prévention des risques industriels et technologiques

Type:
Décret

Numero:
91-861

Date:
1991-06-08

Titre:
Portant virement de la taxe annuelle de contrôle des EDII au profit de l'agence nationale de protection de l’environnement

Resume:
Portant virement des ressources reçues au titre de la taxe annuelle de contrôle des établissements dangereux, insalubres ou incommodes au profit de l'agence nationale de protection de l’environnement. - Article 1 : A la fin de chaque trimestre les ressources perçues au titre de la taxe annuelle de contrôle des établissements dangereux, insalubres ou incommodes au profit de l'agence nationale de protection de l’environnement.


==================================================

Application:
SÉCURITÉ

Theme:
Prévention des risques industriels et technologiques

Type:
Arrêté

Numero:
15-11-2005

Date:
2005-11-15

Titre:
La nomenclature des établissements dangereux, insalubres ou incommodes

Resume:
Article 1 : Les établissements dangereux, insalubres ou incommodes sont classés dans les différentes catégories prévues à l'article 294 du code de travail conformément à la nomenclature annexée au présent arrêté. Article 2 : Les établissements classés autorisés avant la publication de ce présent arrêté dans une catégorie inférieure devront régulariser leur situation juridique conformément au décret n°68-88 du 28 Mars 1968 au plus tard dans les cinq ans qui suivent son entrée en vigueur.


==================================================

Application:
SÉCURITÉ

Theme:
Prévention des risques industriels et technologiques

Type:
Arrêté

Numero:
20-02-2010

Date:
2010-02-20

Titre:
Les termes de référence de l'étude de dangers et du plan d'opération interne relatives aux établissements

Resume:
- Article premier : Le présent arrêté fixe les termes de référence de l'étude de dangers et du plan d'opération interne qui doivent être annexés à la demande d'ouverture d'un établissement classé de première et deuxième catégorie, et ce, conformément à l'article 3 du décret n°2006-2687 du 9 octobre 2006. - Article 4 : L'étude de dangers doit exposer les risques éventuels générés par l'activité de l'établissement y compris l'analyse et l'évaluation des ces risques. Elle doit présenter une description détaillée des accidents pouvant survenir et leurs causes internes ou externes ainsi qu'une description détaillée de la nature, de la typologie et de l'étendue des effets que peut engendrer tout éventuel accident. L'étude de dangers doit être appuyée par les plans, les plans descriptifs, les paragraphes de calcul nécessaires et par des scénarios clairs et précis. L'étude de dangers doit exposer et justifier les mesures préventives et les démarches que l'exploitant prendra sous sa responsabilité pour réduire la probabilité d'occurrence des accidents et limiter leurs éventuelles conséquences sur les personnes, les biens et l'environnement. - Article 5 : L'étude de dangers doit prendre en considération toutes les composantes de l'établissement et ses équipements, y compris : - la conception des installations et des équipements, - la nature, les quantités et les caractéristiques des matières dangereuses utilisées, - les méthodes d'exploitation et les modes de production, - les méthodes et les procédures de contrôle et de commande, - la formation des employés et l'organisation de l'établissement en matière de sécurité. L'étude de dangers doit prendre en compte également les causes des accidents susceptibles de survenir qu'elles soient internes ou externes tels que les séismes et les inondations en plus des facteurs et des dangers qui peuvent résulter des réseaux et des établissements dangereux voisins, les services et les infrastructures proches tels que les routes importantes, les voies ferrées, les cours d'eau, les ports, les aéroports et autres. - Article 7 : Le plan d'opération interne doit définir également les ressources et les moyens matériels et humains nécessaires pour faire face auxdits accidents. - Article 8 : Le plan d'opération interne doit être achevé et visé par la direction de la sécurité du ministère de l'industrie et de la technologie ainsi que l'office national de la protection civile, et ce, avant le démarrage de l'exploitation de l'établissement. - Article 9 : Les établissements classés de première catégorie doivent réaliser au moins un exercice à blanc par an du plan d'opération interne et ce, en coordination avec les services de la direction de la sécurité au ministère de l'industrie et de la technologie et l'office national de la protection civile. - Article 9 : Les établissements classés de première catégorie doivent réaliser au moins un exercice à blanc par an du plan d'opération interne et ce, en coordination avec les services de la direction de la sécurité au ministère de l'industrie et de la technologie et l'office national de la protection civile. - Article 11 : Le plan d'opération interne doit inclure au moins une analyse détaillée des éléments suivants : 1. description générale de l'établissement et de son fonctionnement, 2. nom, fonction et adresse du responsable de sécurité et de l'exécution du plan d'opération interne, 3. liste des membres de l'équipe de sécurité, leurs compétences et leurs adresses, 4. organisation de l'établissement pendant les accidents et répartition des missions, 5. schéma de l'alarme et de l'alerte, 6. les scénarios des principaux accidents possibles et les besoins pour y faire face en termes de moyens matériels et humains et les mesures de sécurité et de protection, 7. inventaire des moyens d'extinction des incendies et de lutte contre les accidents, les outils de secours et leurs emplacements, 8. Formation et qualification spécialisées dans le domaine de la sécurité, 9. programmes des exercices à blancs périodiques.


==================================================

Application:
SÉCURITÉ

Theme:
Prévention des risques industriels et technologiques

Type:
Arrêté

Numero:
23-02-2010

Date:
2010-02-23

Titre:
 Mise à jour de la nomenclature des établissements dangereux, insalubres ou incommodes 

Resume:
- Article premier : La nomenclature des établissements dangereux, insalubres ou incommodes fixée par l'arrêté susvisé du 15 novembre 2005 est modifiée conformément l'annexe l du présent arrêté.


==================================================

Application:
SÉCURITÉ

Theme:
Prévention des risques industriels et technologiques

Type:
Arrêté

Numero:
25-01-2012

Date:
2012-01-25

Titre:
Modifiant et complétant l'arrêté du ministére de l'industrie, de l'énergie et des petites et moyennes entreprises

Resume:
- Article premier : La nomenclature des établissements dangereux, insalubres ou incommodes fixée par l'arrêté du 15 novembre 2005 susvisé est modifiée conformément à l'annexe 1 du présent arrêté.


==================================================

Application:
SÉCURITÉ

Theme:
Prévention des risques industriels et technologiques

Type:
Arrêté

Numero:
24-10-2012

Date:
2012-10-24

Titre:
Mise à jour de la nomenclature des établissements dangereux, insalubres ou incommodes.

Resume:
- Article premier : La nomenclature des établissements dangereux, insalubres ou incommodes fixée par l'arrêté susvisé du 15 novembre 2005 est modifiée conformément l'annexe l du présent arrêté. - Article 2 : La nomenclature des établissements dangereux, insalubres ou incommodes fixée par l'arrêté susvisé du 15 novembre 2005 est complétée conformément l'annexe 2 du présent arrêté.


==================================================

Application:
SÉCURITÉ

Theme:
Prévention des risques industriels et technologiques

Type:
Arrêté

Numero:
30-01-1962

Date:
1962-01-30

Titre:
Composition du comité spéciale, sur les établissements dangereux, insalubres ou incommodes

Resume:
Ce présent arrêté fixe la composition du comité spéciale, prévu à l'article 3 du décret du 27 Mars 1919 sur les établissements dangereux, insalubres ou incommodes.


==================================================

Application:
SÉCURITÉ

Theme:
Prévention des risques industriels et technologiques

Type:
Arrêté

Numero:
18-10-2006

Date:
2006-10-18

Titre:
Modifiant l’arrêté relatif aux prestations administratives et aux conditions de leur octroi

Resume:
Modifiant l’arrêté du ministre de l’industrie et de l’énergie du 20 décembre 2002, relatif aux prestations administratives rendues par les services relevant du ministère de l’industrie et de l’énergie et aux conditions de leur octroi. - Article premier : Est abrogée, l’annexe n° 3-1 de l’arrêté susvisé du 20 décembre 2002 et remplacée par l’annexe n° 3-1 jointe au présent arrêté.


==================================================

Application:
SÉCURITÉ

Theme:
Prévention des risques industriels et technologiques

Type:
Arrêté

Numero:
06-10-2020

Date:
2020-10-06

Titre:
 Les conditions d’exploitation des réservoirs contenant des gaz inflammables liquéfiés

Resume:
- Article premier : Sont abrogées les dispositions de l’article 20 de l’arrêté du ministre de l’industrie, de l’énergie et petites et moyennes entreprises du 8 août 2009 susvisé et remplacées par les dispositions suivantes : Article 20 (nouveau) : les dispositions du présent arrêté s’appliquent aux réservoirs installés avant l’entrée en vigueur du présent arrêté s’ils font l’objet d’une modification notable de leurs caractéristiques ou de leur contenue de nature à entraîner une augmentation des risques potentiels liés à leur exploitation et dans tous les cas dans un délai ne dépassant pas le 31 décembre 2023. Article 2 : Le présent arrêté sera publié au Journal officiel de la République tunisienne. Tunis, le 6 octobre 2020.


==================================================

Application:
SÉCURITÉ

Theme:
Prévention des risques industriels et technologiques

Type:
Arrêté

Numero:
---

Date:
2022-03-03

Titre:
Relatif à l’organisation du commerce de distribution du gaz de pétrole liquéfié et du pétrole lampant

Resume:
ARTICLE 2 : Sont interdites la mise en bouteille ou la recharge du gaz de pétrole liquéfié destiné à l’usage domestique ainsi que sa mise en vente, sa présentation ou sa détention dans des contenances autres que celles prévues à l’article premier du présent arrêté. La vente ou la présentation à la vente du gaz de pétrole liquéfié destiné à l’usage domestique au profit des professionnels est strictement interdite ainsi que sa reprise, son utilisation, l’essai de son utilisation, sa détention ou son stockage quelles que soient les finalités et indépendamment de la nature de leurs activités


==================================================

Application:
SÉCURITÉ

Theme:
Dispositions administratives

Type:
Arrêté

Numero:
30-08-2017

Date:
2017-08-30

Titre:
Portant agrément de l'avenant n° 14 à la convention collective sectorielle des industries des matériaux de construction

Resume:
- Article premier - L'avenant n° 14 à la convention collective sectorielle des industries des matériaux de construction, signé le 11 juillet 2017 et annexé au présent arrêté, est agréé(1) - Article 2 : Les dispositions de cet avenant sont rendues obligatoires sur l'ensemble du territoire de la République pour tous les employeurs et les travailleurs des activités énumérées dans l'article premier de la convention collective sectorielle susvisée.


==================================================

Application:
SÉCURITÉ

Theme:
Dispositions administratives

Type:
Décret gouvernemental

Numero:
2018-1067

Date:
2018-12-25

Titre:
Complétant le décret n° 93-982 du 3 mai 1993, fixant le cadre général de la relation entre l’administration et ses usagers

Resume:
- Article premier : Il est ajouté au décret n°93-982 du 3 mai 1993 susvisé, l’article 7 (quarter) du titre trois et le titre quatre (nouveau) qui comprend les articles 11 (bis) et 11 (ter) comme suit : - Article 7 (quarter) : Les documents nécessitant la légalisation de signature et ceux nécessitant la certification de la conformité des copies à l’original pour les services mentionnés à l’article 7 du présent décret gouvernemental, sont fixés par les annexes 1 et 2 du présent décret gouvernemental (1). --- Titre IV ** Amélioration de la qualité des prestations administratives ** - Article 11 (bis) : Les services relevant de l’Etat, des collectivités locales ou des établissements et entreprises publics qui ont une relation directe avec le public sont tenus d’améliorer la qualité des leurs prestations administratives à travers la fixation d’un ensemble d’engagements de qualité à réaliser, contenu dans un document appelé « la charte du citoyen » et qui sera publié au profit du public. - Article 11 (ter) : Les services publics concernés cités à l’article 11 (bis) du présent décret gouvernemental seront chargés de réaliser, au moins une fois par an, une auto-évaluation du degré d’accomplissement des engagements fixés dans la charte du citoyen et de fixer des actions correctives et soumettre les résultats de l’évaluation au chef de structure concernée. Les dits services sont soumis, également, de façon périodique, à une évaluation externe de la part d’une structure d’évaluation mandatée à cet effet par l’autorité de tutelle ou par la Présidence du gouvernement. - Article 2 : Sont abrogées toutes les dispositions réglementaires contraires au présent décret gouvernemental.


==================================================

Application:
SÉCURITÉ

Theme:
Règlement de sécurité des établissements dangereux, insalubres ou incommodes

Type:
Arrêté

Numero:
21-09-2018

Date:
2018-09-21

Titre:
Règlement de sécurité des établissements dangereux, insalubres ou incommodes

Resume:
N/A


==================================================

Application:
SÉCURITÉ

Theme:
dispositions administratives liée à l'état	

Type:
Arrêté

Numero:
2020-2003

Date:
2020-08-14

Titre:
Fixant les redevances des interventions assurées par l’office national de la protection civile

Resume:
Fixant les redevances des interventions, opérations et prestations particulières payantes que l’office national de la protection civile assure auprofit des entreprises publiques et despersonnes privées. ** Les redevances relatives à la présence préventive des agents de l’office national de la protection civile aux différents établissements recevant du public, ou aux établissements classés, et aux différentes manifestations publiques et privées, scientifiques ou artistiques ou culturelles ou sportives sont fixées, hors la taxe sur la valeur ajoutée, comme suit: - les spectacles de théâtre: 8D par agent, 10D par cadre, 20D par médecin. - Les foires : 8D par agent, 10D par cadre, 20D par médecin. - Les manèges et les centres de plaisance : 8D par agent, 10D par cadre, 20D par médecin. - Les manifestations sportives : 10D par agent, 12D par cadre, 22D par médecin. - Les activités sportives diverses : 8D par agent, 10D par cadre, 20D par médecin. - Les festivals : 8D par agent, 10D par cadre, 20D par médecin - Les fêtes autres que les festivals : 10D par agent, 12D par cadre, 22D par médecin. - Les manifestations diverses : 8D par agent, 10D par cadre, 20D par médecin Les redevances au titre de l’utilisation des moyens et équipements de l’office national de la protection civile en cas de présence préventive aux différents établissements recevant du public ou aux établissements classés, et aux différentes manifestations publiques et privées ou scientifiques ou artistiques ou culturelles ou sportives ou autres, sont fixées, hors la taxe sur la valeur ajoutée, comme suit: - Ambulance : 60D - Ambulance médicalisée : 100D - Véhicule d’extinction : 120D - Camion d’extinction : 200D - Embarcation de sauvetage : 120D - Camion de feux d’hydrocarbure : 800D - Camion de secours routiers : 240D Les redevances de formation et de recyclage dans les différentes spécialités de la protection civile et notamment la formation et le recyclage des membres des équipes de sécurité à installer dans les différents types de bâtiments recevant du public et des bâtiments de grande hauteur et les bâtiments abritant des établissement dangereux, insalubres ou incommodes, sont fixées, hors la taxe sur la valeur ajoutée sont fixés comme il est prévu au tableau de l’art 4. Les redevances au titre d’utilisation des moyens et équipements de l’office national de la protection civile dans les interventions et les opérations à caractère non urgent, sont fixées, hors la taxe sur la valeur ajoutée, comme suit: - Les moyens : - Ambulance : 60D -Ambulance médicalisée : 100D - Véhicule d’extinction : 120D - Camion d’extinction : 200D - Camion de ravitaillement : 400D - Echelle mécanique : 900D - Camion d’incendies d’hydrocarbures : 800D - Camion grue : 400D - Embarcation de sauvetage : 120D - Camion de secours routiers : 300D - Camion de transport : 200D Voiture de transport : 60D Les équipements : - Motopompe : 120D - Equipements divers (d’éclairage, de coupure, levage, etc…) 40D.


==================================================

Application:
SÉCURITÉ

Theme:
dispositions administratives liée à l'état	

Type:
Convention

Numero:
15 septembre 1999

Date:
1999-09-15

Titre:
la convention collective nationale de l' électricité et de l'électronique

Resume:
N/A


==================================================

Application:
SÉCURITÉ

Theme:
dispositions administratives liée à l'état	

Type:
Convention

Numero:
-

Date:
2022-04-15

Titre:
avenant de la convention collective  de l'électricité et de l'electronique

Resume:
N/A


==================================================

Application:
SÉCURITÉ

Theme:
dispositions administratives liée à l'état	

Type:
Annonce 

Numero:
97-2019

Date:
2019-10-11

Titre:
Régularisation de la situation financière a titre d’ exploitation d’un établissement classé

Resume:
Les propriétaires des ateliers, des usines, des entrepôts et en général tous les établissements classés émises dans le cadre d'une décision de licence d'ouvrir et d'exploitation d'un établissement classéedans ses différentes catégories( Première, deuxième et Troisième catègorie ) doivent Contacter les détenteurs financiers qui y sont revenus pour effectuer les opérations de paiement, et tous ceux qui ont des objections ou des observations relativesaux paiement de la performance En cas d'arrêt de l'activité de l'établissement soumis à l'autorisation , de la vente ou de la cession de l'autrisatione, à soumettre au directeur de la sécurité du ministère de l'Industrie et des PME dans un délai maximum de quinze jours à compter de la date de la publication de cet annonce. ( Voir pièce Jointe )


==================================================

Application:
SÉCURITÉ

Theme:
dispositions administratives liée à l'état	

Type:
Annonce 

Numero:
--

Date:
2022-12-23

Titre:
Taxe annuelle de contrôle et de surveillance des établissements classés pour l'année 2019

Resume:
Les services de la Direction de la Sécurité du Ministère de l'Industrie, des Mines et de l'Energie ont transmis les grilles annuelles d'extraction des informations des salariés au groupement d'établissements aménagés pour l'année 2019 au niveau des premières directions financières, pour s'y référer en consultant les adresses des ayants droit. rémunérer la prestation pour les personnes physiques et le siège social pour les personnes morales.


==================================================

Application:
SÉCURITÉ

Theme:
dispositions administratives liée à l'état	

Type:
Annonce 

Numero:
25-11-2025

Date:
2025-11-25

Titre:
Avis au public relatif au dépôt dossiers des demandes d’autorisation d’ouverture et d’exploitation établissements classés

Resume:
L’annonce publique publiée le 25 novembre 2025 par le Ministère de l’Industrie, des Mines et de l’Énergie – Direction de la Sécurité informe les opérateurs concernés que le dépôt des dossiers de demandes d’autorisation d’ouverture et d’exploitation des établissements classés doit être effectué exclusivement auprès de la Direction de la Sécurité, selon les modalités et formats définis par l’administration. L’annonce précise que tout dossier incomplet ou non conforme aux exigences réglementaires ne sera pas pris en charge, et rappelle l’obligation de respecter les procédures en vigueur pour l’instruction des demandes d’autorisation.


==================================================

Application:
SÉCURITÉ

Theme:
Bruit - nuissances sonores

Type:
Décret

Numero:
84-1556

Date:
1984-12-29

Titre:
Réglementation des lotissements industriels 

Resume:
Chapitre 03 : Protection de l'Environnement et Assainissement : - Article 26 : Nuissance et pollution : L'acqéureur est réputé connaitre la réglementation en vigueur en matière de l'assainissement * Pollution atmosphérique (Obligation de traitement des odeurs ou autres émanations gazeuses) * Résidus industriels * Nuisance de bruit (le niveau de bruit de jour par une entreprise ne devra pas dépasser 50 décibels, mesurés au droit de la façade des habitations les plus proches de la zone d'activités. De nuit, des précautions supplémentaires devront être prises afin de ne pas provoquer de gène aux riverains). * Eaux usées (à doter de système d'assainissement séparatif, les stocks de liquides dangereux ou insalubres doivent comporter tout dispositif susceptible de retenir les déversements accidentels) * Eaux pluviales (les réseaux de collecte des eaux pluviales ne doivent recevoir aucun liquide autre que les eaux de ruissellement)


==================================================

Application:
SÉCURITÉ

Theme:
Bruit - nuissances sonores

Type:
Arrêté

Numero:
08-01-1966

Date:
1966-01-08

Titre:
La mesure du bruit produit par un véhicule automobile 

Resume:
- Article premier : Le bruit produit par un véhicule à moteur ne doit pas excéder les valeurs suivants (catégories de véhicules: niveaux sonores maxima en décibels) * cyclomoteurs: 76 * vélomoteurs et véhicules assimilés: 80 * motocyclettes et motoculteurs: 86 * véhicules utilitaires d'un poids total en charge inférieur ou égal à 3.5 tonnes: 83 * véhicule de transport en commun: 90 * véhicules utilitaires d'un poids total en charge supérieur à 3.5 tonnes, tracteurs agricoles et machines agricoles automotrices: 90 - Article 2 : Les organes d'un véhicule et notamment le dispositif d'échappement doivent être maintenus en bon état ou remplacés en cas de nécessité de sorte que le bruit produit par ce véhicule ne dépasse pas les valeurs fixés au présent arrêté. - Article 3 : Dans les agglomérations, il est interdit d'utiliser le moteur à des régimes excessifs, notamment au démarrage ou au point fixe et de procéder à des accélérations répétées. - Article 4 : Toute modification du système d'échappement susceptible d’accroître le bruit émis par le véhicule est interdite.


==================================================

Application:
SÉCURITÉ

Theme:
Bruit - nuissances sonores

Type:
Arrêté

Numero:
10-04-1999

Date:
1999-04-10

Titre:
Relatif aux paiement d'amendes transactionnelles pour contraventions aux règlements sur l'hygiène et la police sanitaire     

Resume:
Le présent arrêté définie les trois catégories de contraventions aux règlements sur l'hygiène et la police sanitaire à l'intérieur des périmètres relevant des conseils régionaux et des communes ainsi les amendes prévues pour chaque catégorie de contravention. Les contraventions aux règlements sur l'hygiène et la police sanitaire sont soulevées par les présidents conseils régionaux et des communes, les agents de police et les agents de la garde national.


==================================================

Application:
SÉCURITÉ

Theme:
Gestion et transport des matières dangereuses  

Type:
Décret

Numero:
2005-3079

Date:
2005-11-29

Titre:
La liste des matières dangereuses qui sont transportées par route obligatoirement sous le contrôle

Resume:
Fixant la liste des matières dangereuses qui sont transportées par route obligatoirement sous le contrôle et avec l'accompagnement des unités de sécurité. Les matières dangereuses qui sont transportées par route obligatoirement sous le contrôle et avec l'accompagnement des unités de sécurité sont : 1- les matières et objets explosifs et explosibles de la classe 1, 2- les matières radioactives de la classe 7 dont l’activité dépasse 3,7 multiplié par 10 puissance 10 (10 exp 10) kilobecquerel (kBq) (l'équivalent de 1000 curies) 3- les matières corrosives de la classe 8 figurant au tableau annexé au présent décret, et ce, lorsque la quantité transportée de la ou des matières figurant au tableau précité dépasse 500 kg.


==================================================

Application:
SÉCURITÉ

Theme:
Gestion et transport des matières dangereuses  

Type:
Avis

Numero:
28-09-2010

Date:
2010-09-28

Titre:
Attestation d'approvisionnement des produits chimiques

Resume:
* Production, stockage et écoulement : la fabrication, le stockage et l'écoulement des produits chimiques dangereux et des acides mentionnés aux annexes 1 et 2 du présent avis sont soumis à l'autorisation d'ouverture et d'exploitation d'un établissement classé en vertu du code de travail promulgué par la loi n°66-27 du 30 Avril 1966 et des dispositions du décret n°2006-2687 du 9 Octobre 2006 relatif aux procédures d'ouverture et d'exploitation d'un établissement dangereux, insalubres ou incommodes avec l'obligation de nommer une personne habilité qui sera chargée de la gestion et de la sécurité des produits stockés * Approvisionnement : Les opérations d'approvisionnement en produits chimiques dangereux et en acides mentionnés aux annexes 1 et 2 du présent avis sont soumises à l'octroi d'une attestation d'approvisionnement conformément au modèle joint à l'annexe 3, et selon le besoin prévisionnel annuel. Cette attestation est délivrée selon l’activité de l'acheteur par les départements concernés * Utilisation industrielle : Les industriels utilisant les produits chimiques dangereux ou les acides mentionnés aux annexes 1 et 2 du présent avis sont tenus de tenir un registre côté et paraphé par les services du ministère de l'industrie et de la technologie pour les établissements industriels implantés dans les gouvernorats du grand Tunis et par les directions régionales du ministère du commerce et de l'artisanat pour les établissements industriels implantés dans les autres gouvernorats, précisant les quantités utilisées ainsi que les quantités stockées


==================================================

Application:
SÉCURITÉ

Theme:
Gestion et transport des matières dangereuses  

Type:
Avis

Numero:
16-08-2005

Date:
2005-08-16

Titre:
Gestion de quelques produits chimiques dangereux

Resume:
* Production et stockage : La fabrication et le stockage des produits chimiques dangereux dont la liste est annexée au présent avis sont soumis à une autorisation d'ouverture et d'exploitation d'un établissement classé conformément au décret n°68-88 du 28 mars 1968 relatif aux établissements dangereux, insalubres et incommodes et de confier la gestion et la sécuritè des stocks de ces produits à une personne habilitèe * Approvisionnement : Les opérations d'approvisionnement en produits chimiques dangereux dont la liste est annexée au présent au présent avis sont soumises à une attestation d'approvisionnement annuelle selon le modèle ci-joint mentionnant l’identité de l'acheteur ainsi que le plafond des quantités autorisées à acquérir, le lieu et les fins d'utilisation. Cette attestation est délivrée selon l’activité de l'acheteur par les départements concernés et par les directions régionales du commerce par les artisans, les petits métiers et les laboratoires ainsi que les scolaires et les établissements de recherche scientifiques et les établissements similaires * Utilisation industrielle : Les industriels utilisant l'un des produits chimiques dangereux dont la liste est annexée au présent avis sont tenus de tenir un registre coté et paraphé par les services du ministère de l'industrie, de l'énergie et des petites et moyennes entreprises précisant les quantités consommées ainsi que les quantités stockées


==================================================

Application:
SÉCURITÉ

Theme:
Dispositions administratives " SST "

Type:
Décret

Numero:
2007-1366

Date:
2007-06-11

Titre:
Détermination des étapes d’application de la loi n° 2004-71 du 2 août 2004

Resume:
Portant détermination des étapes d’application de la loi n° 2004-71 du 2 août 2004, portant institution d’un régime d’assurance maladie aux différentes catégories d’assurés sociaux mentionnés dans les différents régimes légaux de sécurité sociale. - Article premier: A compter du 1èr juillet 2007, les dispositions de la loi n° 2004-71 du 2 août 2004, portant institution d’un régime d’assurance maladie s’appliquent aux assurés sociaux ci-après mentionnées : * les affiliés à la caisse nationale de retraite et de prévoyance sociale, * les affiliés à la caisse nationale de sécurité sociale assujettis aux régimes de sécurité sociale suivants : - le régime des travailleurs salariés dans le secteur non agricole institué par la loi n° 60-30 du 14 décembre 1960 susvisée, - le régime de sécurité sociale dans le secteur agricole institué par la loi n° 81-6 du 12 février 1981, telle que modifiée et complétée par la loi n° 89-73 du 2 septembre 1989, - le régime de sécurité sociale des artistes, des créateurs et des intellectuels prévu par la loi n° 2002-104 du 30 décembre 2002, - le régime de sécurité sociale des travailleurs Tunisiens à l’étranger prévu par le décret n° 89-107 du 10 janvier 1989 susvisé, - le régime des travailleurs non salariés dans le secteur agricole et non agricole prévu par le décret n° 95-1166 du 3 juillet 1995 susvisé.


==================================================

Application:
SÉCURITÉ

Theme:
Dispositions administratives " SST "

Type:
Décret

Numero:
2009-2375

Date:
2009-08-24

Titre:
Institution et organisation du prix national de santé et de sécurité au travail

Resume:
1) Il est institué un prix dénommé « prix national de santé et de sécurité au travail » octroyé aux entreprises régies par le code du travail qui se sont distinguées par leurs efforts continus dans le domaine de santé et de sécurité au travail en vue d’aménager les postes du travail et de réunir les conditions adéquates pour la préservation de la santé au sein de l’entreprise et le renforcement de la prévention des risques professionnels. 2) Les candidatures pour l’obtention du prix national de santé et de sécurité au travail sont déposées par les entreprises concernées au siège du gouvernorat territorialement compétent avant le 31 décembre de chaque année. 3) Le prix national de santé et de sécurité au travail est décerné le 1er mai de chaque année par arrêté du ministre des affaires sociales, de la solidarité et des Tunisiens à l’étranger, sur proposition de la commission nationale. 4) Les candidatures des entreprises ayant obtenu le prix national de santé et de sécurité au travail ne peuvent être retenues de nouveau qu’après dix ans à partir de la date de leur obtention du dernier prix. 5) Le montant du prix national de santé et de sécurité au travail est fixé à dix milles dinars. 6) L’entreprise bénéficiaire du prix reçoit un certificat signé par le ministre des affaires sociales, de la solidarité et des Tunisiens à l’étranger.


==================================================

Application:
SÉCURITÉ

Theme:
Dispositions administratives " SST "

Type:
Décret

Numero:
2002-583

Date:
2002-03-12

Titre:
Modifiant le décret n°96-1050, relatif au Financement par la caisse nationale de sécurité sociale des projets de SST

Resume:
1) La CNSS accorde aux bénéficiaires des prêts destinés au financement des projets visés à l'article 2 du présent décret une prime d'investissement fixée à 20% du coût du projet. 2) Le montant maximum du prêt ne peut excéder les 70% du coût du projet à réaliser dans la limite de 300.000 dinars. Pour le bénéfice du prêt, un autofinancement de 30% au moins du coût du projet, y compris la prime d'investissement, est exigé. 3) L'entreprise bénéficiaire est tenue de constituer en faveur de la caisse nationale de sécurité sociale une hypothèque de 1er rang ou à égalité dans ce rang avec un autre établissement bancaire. 4) L'entreprise bénéficiaire peut présenter une caution bancaire ou toute autre garantie permettant à la caisse susvisée de recouvrer la totalité du montant du prêt.


==================================================

Application:
SÉCURITÉ

Theme:
Dispositions administratives " SST "

Type:
Décret

Numero:
2014-2919

Date:
2014-08-15

Titre:
sécurité sociale

Resume:
- Article 1 : Il est accordée une remise totale et automatique des montants des pénalités de retard dues et qui sont appliquées au titre des régimes de sécurité sociale et du régime de réparation des préjudices résultant des accidents du travail et des maladies professionnelles ainsi que pour les pénalités de retard exigées pour non déclaration de la totalité des salaires, qui ont été acquittées après la date de leur exigibilité, au titre des trimestres écoulés et dans la limite du deuxième trimestre de l’année 2014. - Article 2 : Bénéficient de la mesure prévue à l’article premier du présent décret, les personnes affiliées à la caisse nationale de sécurité sociale et qui lui sont débitrices des montants visés audit article, à condition de s’acquitter de la totalité du principal de la dette et des frais de poursuite et au comptant, et ce, dans un délai n’excédant pas le 31 décembre 2014 à compter de la publication du présent décret.


==================================================

Application:
SÉCURITÉ

Theme:
Dispositions administratives " SST "

Type:
Décret

Numero:
2014-2907

Date:
2014-08-11

Titre:
 fixant le salaire minimum interprofessionnel garanti dans les secteurs non agricoles régis par le code du travail.

Resume:
Le salaire minimum interprofessionnel garanti dans les secteurs non agricoles est fixé, pour les travailleurs des deux sexes âgés de 18 ans au moins, à 319,904 dinars et à 274,559 dinars par mois et 1538 millimes et 1584 millimes l'heure, respectivement pour les régimes de travail de 48 heures et de 40 heures par semaine. Exigence(s) : - Article 2 : Le salaire minimum interprofessionnel garanti, tel que défini à l'article précédent, se compose des éléments suivants : 1- Pour les salariés payés au mois : a) Régime de 48 heures par semaine : - 289,536 dinars en tant que salaires de base, - 30,368 dinars représentant le montant de l'indemnité complémentaire provisoire instituée par le décret n° 81-437 du 7 avril 1981 et majorée par le décret n° 82-501 du 16 mars 1982 susvisés. 2- Pour les salariés payés à l'heure : b) Régime de 48 heures par semaine : - 1392 millimes en tant que salaire de base, - 146 millimes représentant le montant de l’indemnité complémentaire provisoire instituée par le décret n° 81-437 du 7 avril 1981 et majorée par le décret n° 82-501 du 16 mars 1982 susvisés.


==================================================

Application:
SÉCURITÉ

Theme:
Dispositions administratives " SST "

Type:
Décret

Numero:
2014-2906

Date:
2014-08-11

Titre:
fixant l’indemnité de transport pour les salariés payés au salaire minimum interprofessionnel

Resume:
Fixant l’indemnité de transport pour les salariés payés au salaire minimum interprofessionnel garanti dans les secteurs non agricoles régis par le code du travail. - Article 1 : L'indemnité de transport est fixée, pour les salariés payés au salaire minimum interprofessionnel garanti dans les secteurs non agricoles régis par le code du travail, à 26 dinars 112 millimes par mois.


==================================================

Application:
SÉCURITÉ

Theme:
Dispositions administratives " SST "

Type:
Décret

Numero:
91-1936

Date:
1991-12-16

Titre:
Relatif au financement par la caisse nationale de sécurité sociale des projets de santé et de sécurité au travail

Resume:
Le projet en question doit être destiné exclusivement à l'amélioration des conditions de SST des employés notamment par : l'aménagement des postes du travail ; l'acquisition de matériel de Protection Individuelle ou Collective ; l'installation de matériel de sécurité compatible avec les normes requises en matière de SST; l'acquisition de matériel médical destiné à promouvoir la SST aux lieux de travail ; l'aménagement d'unités inter-entreprises de médecine de travail.


==================================================

Application:
SÉCURITÉ

Theme:
Dispositions administratives " SST "

Type:
Décret

Numero:
91-784

Date:
1991-04-01

Titre:
Portant réorganisation de la commission médicale auprès de la caisse nationale de sécurité sociale

Resume:
Portant réorganisation de la commission médicale auprès de la caisse nationale de sécurité sociale.


==================================================

Application:
SÉCURITÉ

Theme:
Dispositions administratives " SST "

Type:
Décret

Numero:
2010-286

Date:
2010-02-15

Titre:
Le conseil supérieur de la santé et fixant ses attributions, sa composition et les modalités de son fonctionnement

Resume:
- Article premier : Est créé un conseil supérieur de la santé ayant pour mission d'examiner les orientations générales de la politique sanitaire. Dans ce cadre, il donne son avis notamment sur les objectifs fixés pour le secteur de la santé ainsi que les moyens nécessaires à leur concrétisation et le suivi de leur réalisation de manière périodique.


==================================================

Application:
SÉCURITÉ

Theme:
Dispositions administratives " SST "

Type:
Décret

Numero:
2008-173

Date:
2008-03-24

Titre:
Fixant la liste des avantages exclus de l’assiette de cotisation au titre des régimes de sécurité sociale

Resume:
Les assurés sociaux mentionnés au décret n°2007-1366 du 11 juin 2007, relatif à la détermination des étapes d'application de la loi n°2004-71 du 2 août 2004 susvisée, doivent exercer le droit d’option pour l’une des modalités de prise en charge des prestations de soins dispensées aux assurés sociaux dans le cadre du régime de base d’assurance maladie, et ce, avant la date du 30 avril 2008 inclus.


==================================================

Application:
SÉCURITÉ

Theme:
Dispositions administratives " SST "

Type:
Décret

Numero:
93-1155

Date:
1993-05-15

Titre:
Code de déontologie médicale tunisien

Resume:
- Article premier : Les dispositions du présent code s'imposent à tout médecin inscrit au tableau de l'ordre tenu par le conseil national de l'ordre des médecins de Tunisie ainsi qu'à tout médecin exécutant un acte professionnel dans les conditions prévues par la loi susvisée n° 91-21 du 13 mars 1991 ou par une convention internationale dûment ratifiée ainsi qu'aux étudiants en médecine effectuant un remplacement. Les infractions à ces dispositions relèvent du conseil de discipline de l'ordre.


==================================================

Application:
SÉCURITÉ

Theme:
Dispositions administratives " SST "

Type:
Arrêté

Numero:
---

Date:
2003-10-27

Titre:
