id,systeme_id,theme_id,type_id,numero,application_id,date,journal,titre,resume,joint,complement
1,1,1.0,1,66-27,2,1966-04-30,code du travail,Article 294,"Les établissements dangereux insalubres ou incommodes sont classés en trois catégories, suivant les dangers ou la gravité des inconvénients inhérents a leur exploitation - Première catégorie : établissements qui doivent êtres éloignes des centres urbaines et des habitations particulières. - Deuxième catégorie : établissements dont l'éloignement des habitations n'est pas rigoureusement nécessaires, mais à condition d'application des mesures de sécurité pour prévenir les dangers ou les incommodités - Troisième catégorie : établissements qui ne présentent pas d'inconvénients ni pour la santé publique, ni pour le voisinage, sont soumis sous la surveillance administrative à des prescriptions générales édictées dans l’intérêt de voisinage ou de la santé publique.",Loi_n_66_27-0.pdf,
2,1,126.0,1,66-27,2,1966-04-30,code de travail,Article 293,"Les manufactures, ateliers, usines, magasins, chantiers et d'une manière générale, tous les établissements qui présentent des causes de dangers ou des inconvénients, soit pour la sécurité, la salubrité ou la santé du personnel qui y est occupé, soit pour la santé publique, soit encore pour l'agriculture, sont soumis à la surveillance de l’autorité administratives.",Loi_n_66_27.pdf,
3,1,3.0,1,66-27,2,1966-04-30,Code du travail,Article 322,"Est puni d'une amende de 144 à 720 dinars et d'un emprisonnement de seize jours à deux mois ou de l'une de ces deux peines quiconque a exploité sans autorisation préalable un établissement classé et quiconque à continuer l'exploitation d'un établissement dans la fermeture provisoire a été ordonnée. Le tribunal peut également ordonnée la position des scellés sur les appareils, les machines et les portes de l’établissement.",322_vf.pdf,
4,1,20.0,4,2004-956,2,2004-04-13,33 / 2004,"La composition, les attributions et les modalités d fonctionnement du comité spécial des établissements classés ","- Article 1 : 1) Fixation de la composition du comité spécial des établissements dangereux, insalubres ou incommodes. - Article 2 : Le comité assume un rôle consultatif d'assistance à la prise des décisions, il donne son avis à propos : - des textes législatifs et réglementaires relatifs aux établissements dangereux, insalubres ou incommodes, - du classement des établissements dangereux, insalubres ou incommodes, - des arrêtés d'autorisation d'ouverture et de fermeture de ces établissements. 3) Le comité se réunit sur convocation de son président quatre fois par an au moins et chaque fois que nécessaire 4) Les procès-verbaux des réunions du comité sont consignés dans un registre tenu par la direction de la sécurité au ministère de l'industrie et de l'énergie qui assure le secrétariat du comité",decret_2004_956.pdf,
11,2,8.0,5,08-01-1966,2,1966-01-08,93 / 1966,La mesure du bruit produit par un véhicule automobile ,"- Article premier : Le bruit produit par un véhicule à moteur ne doit pas excéder les valeurs suivants (catégories de véhicules: niveaux sonores maxima en décibels) * cyclomoteurs: 76 * vélomoteurs et véhicules assimilés: 80 * motocyclettes et motoculteurs: 86 * véhicules utilitaires d'un poids total en charge inférieur ou égal à 3.5 tonnes: 83 * véhicule de transport en commun: 90 * véhicules utilitaires d'un poids total en charge supérieur à 3.5 tonnes, tracteurs agricoles et machines agricoles automotrices: 90 - Article 2 : Les organes d'un véhicule et notamment le dispositif d'échappement doivent être maintenus en bon état ou remplacés en cas de nécessité de sorte que le bruit produit par ce véhicule ne dépasse pas les valeurs fixés au présent arrêté. - Article 3 : Dans les agglomérations, il est interdit d'utiliser le moteur à des régimes excessifs, notamment au démarrage ou au point fixe et de procéder à des accélérations répétées. - Article 4 : Toute modification du système d'échappement susceptible d’accroître le bruit émis par le véhicule est interdite.",Arrete_08_01_1966-0.pdf,
12,2,8.0,5,10-04-1999,2,1999-04-10,33 / 1999,Relatif aux paiement d'amendes transactionnelles pour contraventions aux règlements sur l'hygiène et la police sanitaire     ,"Le présent arrêté définie les trois catégories de contraventions aux règlements sur l'hygiène et la police sanitaire à l'intérieur des périmètres relevant des conseils régionaux et des communes ainsi les amendes prévues pour chaque catégorie de contravention. Les contraventions aux règlements sur l'hygiène et la police sanitaire sont soulevées par les présidents conseils régionaux et des communes, les agents de police et les agents de la garde national.",Arrete_10_04_1999.pdf,
13,3,8.0,5,27-08-1984-3,3,1984-08-27,51 / 1984,Relatif au contrôle au point fixe du niveau sonore des véhicules automobiles   ,"Des dérogations temporaires pourront être accordées par les services compétents du ministre des transports et des communications pour les véhicules usagées. --------------------------------------------------------- La mesure sera effectuée dans les conditions suivantes:_ Véhicule arrêté, moteur à sa température normale d'utilisation alimenté _ il sera procédé à au moins trois accélérations préliminaires successives aussi rapides que possible jusqu’au régime maximum du moteur, de façon à éliminer autant que possible les suies et résidus du système de l’échappement, et à réduire au minimum l'effet d'inertie de l'alimentation en air quand un suralimenter est utilisé. --------------------------------------------------------- La mesure proprement dite sera faite au cours d'une quatrième accélération exécutée immédiatement après les 3 premières. ---------------------------------------------------------- Pour les moteurs à suralimenter embrayage, il sera procédé à 2 processus complets de mesure avec accélérations préliminaires, le suralimenter étant embrayé dans un cas et débrayé dans l'autre la mesure sera la plus élevée des 2 mesures obtenues --------------------------------------------------------- Les mesures seront effectuées par un laboratoire agrée par le ministre des transports et des communications.",Arrete_27_08_1984_3-0.pdf,
14,2,8.0,4,84-1556,2,1984-12-29,04 / 1985,Réglementation des lotissements industriels ,"Chapitre 03 : Protection de l'Environnement et Assainissement : - Article 26 : Nuissance et pollution : L'acqéureur est réputé connaitre la réglementation en vigueur en matière de l'assainissement * Pollution atmosphérique (Obligation de traitement des odeurs ou autres émanations gazeuses) * Résidus industriels * Nuisance de bruit (le niveau de bruit de jour par une entreprise ne devra pas dépasser 50 décibels, mesurés au droit de la façade des habitations les plus proches de la zone d'activités. De nuit, des précautions supplémentaires devront être prises afin de ne pas provoquer de gène aux riverains). * Eaux usées (à doter de système d'assainissement séparatif, les stocks de liquides dangereux ou insalubres doivent comporter tout dispositif susceptible de retenir les déversements accidentels) * Eaux pluviales (les réseaux de collecte des eaux pluviales ne doivent recevoir aucun liquide autre que les eaux de ruissellement)",Decret_84_1556-0.pdf,
16,3,9.0,5,08-03-2006,3,2006-03-08,22 / 2006,Pourtant approbation des cahiers des charges relatifs aux procédures environnementales,"Ce présent arrêté du ministre de l'environnement et du développement durable, pourtant approbation des cahiers des charges aux procédures environnementales que le maître de l'ouvrage et le pétitionnaire doit respecter pour les catégories d'unités soumises aux cahiers des charges .",08_mars_2006.pdf,
17,59,142.0,14,---,7,1976-11-11,82 / 1976,Convention collective Sectorielle des  teintureries et blanchisseries 1976,,convetion_collective_teintures_et_blanchissements.pdf,
18,3,11.0,5,17-01-1990,3,1990-01-17,6 / 1990,Relatif à la création de l'agence municipale ,"Arrêté du ministre de intérieure qui indique que la commune de Tunis a l'autorisation de créer un établissement public communal à caractère économique dénommée "" Agence municipale de traitement et de la valorisation des déchets "", qui a comme mission ; la création des décharges contrôlées, la surveillance de leur gestion, et la création des unités de traitement des ordures.",Arrete_17_01_1990.pdf,
19,47,,5,07-07-2006,2,2006-07-07,58 / 2006,Les conditions et les mesures pour la délivrance de l'attestation de prévention.,"Ce arrête fixe les conditions et les mesures pour la délivrance de l'attestation de prévention. Article premier : Sont abrogées, les dispositions de l’article 4 de l’arrêté du ministre de l’intérieur et du développement local du 17 août 2004 susvisé, et remplacées par les dispositions suivantes : * * Article 4 (nouveau) : L’attestation de prévention ne peut être délivrée que si les mesures de prévention et de sécurité contre les risques d’incendie, d’explosion et de panique, recommandées par les services de la protection civile après constat du local, ont été prises par le requérant dans les délais fixés par le présent arrêté. * * Article 2 : Sont supprimés, à l’alinéa premier de l’article 5 de l’arrêté du ministre de l’intérieur et du développement local du 17 août 2004 susvisé, le quatrième et le cinquième tiret. Art. 3. - Le présent arrêté se",Arrete_07_07_2006_1.pdf,
20,10,,4,2004-1876,2,2004-08-11,67 / 2004,Relatif à la conformité des locaux et à l'attestation de prévention ,"Article 01 : Est supprimée l'attestation de conformité des locaux et de prévention des incendies, prèvu par le décret susvisé n°96-6 du 02 Janvier 1996. Aricle 02 : Les exploitants des locaux destinées a l'exercice d’activités commerciales ou artisanales doivent obtenir une attestation de prévention délivrée par les services de la protection civile selon les conditions et les exigences mentionnées par la réglementation. Aricle 03 : Les conditions gènerales de conformité des locaux sont déterminées par un cahier de charge.",Decret_2004_1876.pdf,
21,3,13.0,5,03-04-1997,3,1997-04-03,32 / 1997,Portant homologation de la norme tunisienne relative aux valeurs limites d'émissions des polluants des cimenteries  ,"Arrêté du ministre de l'industrie, Portant homologation de la norme tunisienne relative aux valeurs limites d'émissions des polluants des cimenteries ; indique q'est homologué la norme tunisienne : "" N.T 106.05 : protection de l'environnement, valeurs limites d’émission des polluants des cimenteries.",Arrete_03_04_1997.pdf,
22,4,14.0,4,2002-693,3,2002-04-01,29 / 2002,Les conditions et Les modalités de reprise des huiles lubrifiantes et des filtres à huile usagés et de leur gestion,"Les détenteurs des huiles lubrifiantes et des filtres à huile usagés sont tenus de : Collecter les huiles lubrifiantes et les filtres à huile usagés dans des conteneurs réservés à cet effet, placés dans des stations couvertes revêtues et accessibles aux véhicules de collecte de ces déchets. Ces stations doivent être aménagées de manière à permettre aux détenteurs un contrôle continu des conteneurs pour s'assurer la détection des fuites d'huiles. Prendre les mesures nécessaires afin d'assurer l'entretien et la maintenance des conteneurs et des stations de collecte des huiles usagées et des filtres à huiles usagées collecter les huiles lubrifiantes usagées provenant de leur installation et de les stocker dans des conditions de séparation évitant leur mélange avec tous autres produits, telles que l'eau ou l'essence ainsi qu'avec toute autre catégorie de déchets (Art.12) =================================== Les détenteurs des huiles lubrifiantes et des filtres à huile usagés sont tenus de :Livrer les huiles lubrifiantes et les filtres à huile usagés exclusivement aux personnes autorisées à exercer les activités de gestion de ces déchets (Art. 12) =================================== Les détenteurs des huiles lubrifiantes et des filtres à huile usagés sont tenus de :Tenir un registre coté et paraphé ou sont consignées consécutivement les quantités (Art.12)",Decret_2002_693-0.pdf,
23,3,70.0,3,2007-34,3,2007-11-04,45 / 2007,La qualité de l'air,"Les mesures de prévention de la pollution de l'air de sources mobiles sont : Plan de prévention urbain Fixation de valeurs limites à la sources Possibilités de mise en place de mesures particulières Plan de déplacement urbain doit tenir compte : - De l'équilibre entre le besoin de déplacement et la protection de la santé publique ainsi que de l'environnement - De la garantie de la fluidité de la circulation - De l'organisation et la coordination des modes de transport par l'utilisation appropriée et optimale du réseau routier - De la promotion des modes de transport les moins polluants et les moins consommateurs d'énergie Plan de déplacement urbain doit adopter les orientations suivantes : - la diminution des catégories de moyens de transport les plus polluants de l'air; - Le développement du transport collectif et des moyens de transport économes en énergie et les moins polluants; - Usage plus efficace du réseau routier principal, notamment par sa répartition sur les différents modes de transport, de manière à limiter les polluants de l'air",Loi_2007_34-0.pdf,
24,38,13.0,5,27-08-1984,3,1984-08-27,51 / 1984,Relatif aux fumées produites par les véhicules automobiles,"Les moteurs des véhicules automobiles doivent être conçus, construits, réglés, entretenus, alimentés et conduits, réglés, entretenus;alimentés et conduits de façon à ne pas provoquer d'émission de fumées nuisibles ou incommodantes. ------------------------------------------------------ Les véhicules en stationnement doivent avoir leur moteur arrêté, sauf en cas de nécessite. ------------------------------------------------------- Aucun véhicule en service ne doit émettre pendant la marche ou l'arrêt des fumées nettement teintées ou opaques (les émissions fugitives sont admises au moment des changements de régime du moteur). ------------------------------------------------------- Les conducteur ou le propriétaire du véhicules est astreint à présenter le véhicule au centre de visite technique afin de justifier des répartitions ou réglages effectués en vue de sa mise en conformité avec les dispositions réglementaires. -------------------------------------------------------- La mesure de l'émission sera faite au moyen d'un opacimétrie à cellule photo électrique d'un modèle agrée par le ministre des transports et des communication. -------------------------------------------------------- Le cadran de l'opacité sera gradué en 100 unités de 0 à 100 --------------------------------------------------------- l'appareil ne devra pas excéder les valeurs indiquées ci après: Voitures particulières(40 unités) , Autobus et autocars(45 unités), véhicules industriels de moins de 6 tonnes de poids total autorisé (50 unités),véhicules industriels et commerciaux de plus de 19 tonnes de poids total roulant autorisé(60 unités), véhicules et tracteurs agricoles(60 unités), véhicules spéciaux de travaux publics(60 unités) ( avec une tolérance de 10 unités si le véhicule ne bénéficie pas d'une dérogation. --------------------------------------------------------- 80 unités s'il s'agit d'un véhicule bénéficiant d'une dérogation quelle que soit la catégorie à laquelle ce véhicule appartienne.",27_08_1984.pdf,
25,3,13.0,5,13-04-1996,3,1996-04-13,34 / 1996,Portant homologation des normes tunisienne relatives à l'air ambiant,Portant homologation des normes tunisienne relatives à l'air ambiant,Arrete_13_04_1996.pdf,
26,3,13.0,5,28-12-1994,3,1994-12-28,2 / 1995,Homologation de la norme NT 106.4,"La norme visée à l'article premier du présent arrêté, est d'application obligatoire,",Arrete_28_12_1994.pdf,
27,3,13.0,4,2010-2519,3,2010-09-28,80 / 2010,Fixation des valeurs limite à la source des polluants de l'air de sources fixes. ,"- Article 3 : Obligation de prendre toutes les mesures nécessaires afin de limiter des risques des polluants de l'air ( Mesure de la qualité de l'air, mise en place de la nouvelle technologie...) Les installations doivent être conçues, installées et exploitées de manière à éviter, limiter et prévenir à la source les polluants de l’air, notamment par la mise en place de technologies propres, le traitement des émissions en fonction de leurs caractéristiques et la réduction des quantités rejetées. L'exploitant est tenu de prendre toutes les mesures de précaution nécessaires dans la conception de l’installation, son installation et son exploitation afin de limiter les risques de pollution accidentelle de l'air. Les consignes d'exploitation de l'ensemble des installations doivent mentionner explicitement les opérations de contrôle à effectuer, en marche normale et à la suite d'un arrêt pour travaux de modification ou d'entretien de façon à permettre en toutes circonstances le respect des dispositions du présent décret.",Decret_2010_2519.pdf,
28,5,15.0,3,89-20,3,1989-02-22,16 / 1989,Fixe les autorisations d'exploitation des carrières et de leur renouvellement,"Le présent loi Fixe les autorisations d'exploitation des carrières et de leur renouvellement, fixe les obligations mises à la charge des exploitations de carrière. Article 5 : Toute activité de carrière est soumise à une autorisation de l'administration compétente suite à une reconnaissance préalable des lieux et après avis de la commission consultative des carrières concernées. L'obtention de l'autorisation est assujettie à la signature par la pétitionnaire d'un cahier des charges fixant l'ensemble des obligations générales et particulière qui lui incombent.",Loi_89_20.pdf,
29,5,15.0,2,2000-97,3,2000-11-20,93 / 2000,Réglementant l'exploitation des carrières,Article unique : Il est ajouté au chapitre II de la loi n°89-20 du 22 février 1989.,Loi_2000_97.pdf,
30,5,15.0,5,08-03-2006,3,2006-03-08,22 / 2006,Portant approbation des cahiers des charges relatifs aux procédures environnementales,"Le présent arrêté Portant approbation des cahiers des charges relatifs aux procédures environnementales que le maître de l’ouvrage ou le pétitionnaire doit respecter pour les catégories d’unités soumises aux cahiers des charges. Article unique. - Sont approuvés, les dix huit (18) cahiers des charges annexés au présent arrêté, relatifs aux mesures environnementales que le maître de l’ouvrage ou le pétitionnaire doit respecter pour les catégories des unités énumérées à l’annexe II du décret susvisé n° 2005-1991 du 11 juillet 2005.",08_03_2006.pdf,
31,4,16.0,4,2008-2745,3,2008-07-28,65 / 2008,Fixation des conditions et modalités  de gestion des déchets des activités sanitaires,Assurer le traitement et l’élimination des déchets des activités sanitaires sans porter atteinte à la santé publique et à l'environnement. ------------------------------------------------------------ Les producteurs et les détenteurs des déchets des activités sanitaires sont tenus de : Trier à la source les déchets des activités sanitaires dangereux selon leur nature et leur spécificité. Collecter ces déchets et la disposer dans un service sanitaire le plus proche,Decret_2008_2745.pdf,
32,4,16.0,5,23-07-2012,3,2012-07-23,,"Portant approbation, du manuel des procédures pour la gestion des activités sanitaire","Les personnes qui gèrent des déchets sanitaires dangereux, sont tenus d'appliquer les prescriptions du manuel des procédures pour la gestion des déchets des activités sanitaires dangereux approuvé par le présent arrêté.",23_07_2012_Portant_approbation_du_manuel_des_procedures_pour_la_gestion_des_activites_sanitaire.pdf,
33,4,16.0,5,06-06-2014,3,2014-06-06,48 / 2014,La  convention conclue entre l'établissement   sanitaire et l'entreprise de gestion des déchets d'activités sanitaires,"- Article 5 : Les structures et les établissements de santé publics et privés, les cabinets de services sanitaires et assimilés, les établissements d'enseignement et les établissements de recherche lorsque les déchets sont produits à l'intérieur de ces établissements, les établissements pour le compte desquels un personnel de santé exerce une activité qui produit des déchets d'activités sanitaires et les personnes physiques qui exercent pour leur propre compte une activité productrice de déchets d'activités sanitaires mentionnés à l'article 4 du décret n° 20082745 du 28 juillet 2008 susvisé, sont tenues de : -------- 1. assurer les opérations de tri, de conditionnement et de stockage des déchets des activités sanitaires, la traçabilité de leur transport intra-muros et respecter les horaires relatifs à la fréquence de l'opération de levée des déchets. -------- 2. citer explicitement les descriptions et les caractéristiques des conteneurs utilisés pour le conditionnement des déchets des activités sanitaires comme suit : - les conteneurs doivent porter des signaux indicatifs et être identifiés par une mention explicite, selon le type de déchet des activités sanitaires : ""les déchets biologiques"", ""les déchets chimiques"", ""les déchets inflammables ou pouvant exploser"", ""les déchets infectieux"", ""les déchets piquants ou coupants"", conformément au manuel de procédures de gestion des déchets des activités sanitaires dangereux, - les conteneurs doivent porter le code et la couleur spécifiques et être étiquetés par un code indiquant l'heure, la date de remplissage des déchets et leur source, conformément au manuel de procédures de gestion des déchets des activités sanitaires dangereux. -------- 3. se conformer aux règles de l'hygiène et aux procédures de la sécurité et de la prévention des risques d'incendie, d'explosion et de panique autorisées par les services de la protection civile dans les locaux intermédiaires et les dépôts centraux réservés au stockage des déchets des activités sanitaires dangereux et ce, conformément à la législation et la réglementation en vigueur.",ARRETE_DU_06_juin_2014.pdf,
34,7,17.0,4,2004-2144,4,2004-09-02,74 / 2004,Les conditions d'assujettissement des établissements consommateurs d'énergie,"-Article 6 : Le rapport d'audit doit être signé par l'expert auditeur. L'établissement assujetti se charge de le remettre à l'agence afin de l'étudier et de se prononcer à son sujet. ----------------------------------------------------- -Article 7: (2 ème paragraphe) Dans le cas où le rapport contient des insuffisances graves, l'établissement doit entamer la réalisation d'un deuxième audit par un autre expert-auditeur das un délai ne dépassant pas les 3 mois à partir de la date de son information du rejet du rapport -------------------------------------------------- - Article 10 : Les établissements assujettis devront désigner un responsable qui sera l'interlocuteur de l'expert-auditeur durant le déroulement de l'audit et qui sera chargé ultérieurement de suivre et de contrôler l'exécution du programme proposé. Le chef de l'établissement est tenu de fournir à l'expert-auditeur toutes les informations nécessaires à la bonne conduite de l'audit énergétique.",Decret_2004_2144.pdf,
35,7,17.0,4,2009-2269,4,2009-07-31,62 / 2009,Fixation des conditions d'assujettissement des établissements consommateurs d'énergie à l'audit énergétique ,"* Les établissements appartenant au secteur industriel dont la consommation totale d’énergie est supérieure ou égale à 800 TEP * Les établissements appartenant aux secteurs du transport, du tertiaire et du résidentiel dont la consommation totale d’énergie est supérieure ou égale à 500 TEP * Tout établissement assujetti à l’audit énergétique est tenu de remettre à l’agence nationale pour la maîtrise de l’énergie les données annuelles de sa consommation énergétique. * Il est également tenu de charger tous les cinq ans un expert-auditeur, ne peuvent exercer la profession d’expert-auditeur en énergie dans les secteurs de l’industrie, u transport, du tertiaire et du résidentiel que les ingénieurs appartenant à des bureaux d’études, les centres techniques ou les ingénieurs-conseils.",Decret_2009_2269.pdf,
36,7,17.0,3,2005-82,4,2005-08-15,65 / 2005,Portant création d'un système de maîtrise de l'énergie,"1) Est crée un système de maîtrise de l’énergie ayant pour but l’appui des actions visant la rationalisation de la consommation de l’énergie, la promotion des énergies renouvelables et la substitution de l’énergie.Des subventions sont octroyées dans le cadre de ce système pour la réalisation notamment des opérations suivantes : - l’audit énergétique, les contrats programmes et la consultation préalable, - la cogénération, - l’installation de bancs pour le diagnostic des moteurs des véhicules, - l’utilisation d’équipements économes en énergie dans l’éclairage public, - le chauffage de l’eau par l’énergie solaire dans les logements et les entreprises privées, - la production de l’électricité à partir des énergies renouvelables, - la substitution de l’énergie par le gaz naturel dans le secteur industriel, le secteur résidentiel et le secteur de transport public collectif, - et toutes autres opérations ayant pour but la maîtrise de l’énergie. 2) Le système de maîtrise de l’énergie est alimenté par : - une taxe due à l’occasion de la première immatriculation des voitures de tourisme dans une série tunisienne, - une taxe due à l’importation ou à la production locale à l’exclusion de l’exportation sur les appareils pour le conditionnement de l’air relevant des numéros 841510, 841520, 841590 et 841869993 du tarif des droits de douane au taux de 10 dinars pour chaque 1000 unités thermiques. 3) La taxe n’est pas due sur les voitures de tourisme : - utilisées dans le secteur du transport public de personnes comme taxis ou louages ou pour le transport rural, - affectées exclusivement au transport des handicapés et bénéficiant d’un régime fiscal préférentiel en vertu de la législation en vigueur, - acquises par les entreprises de location de voitures et qui constituent l’objet de l’exploitation, - acquises par les entreprises de l’enseignement de la conduite automobile et qui constituent l’objet de l’exploitation, - importées par les étrangers non résidents et bénéficiant de l’exonération des droits et taxes à l’importation en vertu de la législation en vigueur, - utilisées dans le tourisme saharien et dans le tourisme de chasse dans les régions montagneuses et par les agences de voyage et acquises dans le cadre de l’article 50 du code d’incitation aux investissements. 4) La taxe n’est pas due sur le produit local s’il est prouvé que la taxe a été payée à l’importation.",Loi_2005_82.pdf,
37,4,75.0,4,2005-3395,3,2005-12-26,1 / 2006,Les conditions et les modalités de collecte des accumulateurs et piles usagés,"Toute personne ayant en sa possession des piles et accumulateurs usagés est tenue de ne pas les jeter dans l’environnement, de ne pas les mélanger avec d’autres déchets, ménagers ou autres et de les déposer, dans le but de s’en débarrasser, dans des conteneurs spécifique à cette fin.",Decret_2005_3395.pdf,
38,4,75.0,5,23-04-2008-2,3,2008-04-23,34 / 2008,Fixation des modalités et du montant de la consigne obligatoire de la reprise des accumulateurs usagés ,"Le montant de la consigne obligatoire est payé par l’acheteur au distributeur lors de l’acquisition d’un accumulateur neuf, et lui sera remboursé lors de la restitution de l’accumulateur usagé. L’acheteur est dispensé de payer ce montant lorsqu'il échange un accumulateur usagé par un accumulateur neuf.",Arrete_23_04_2008_2.pdf,
39,3,11.0,4,97-1102,3,,47 / 1997,Les conditions et des modalités de reprise et de gestion des sacs d'emballages et des emballages utilisées,"1) Le présent décret vise à assurer les conditions nécessaires afin de garantir une reprise et une gestion rationnelle des sacs d'emballage et des emballages utilisés et d'éviter l'impact négatif de leur abandon dans l'environnement. Ses dispositions s'appliquent aux sacs d'emballage en plastique et aux emballages fabriqués totalement ou partiellement en plastique ou en métal, d'une contenance supérieure ou égale à 100 millilitres destinés à être commercialisés sur le marché local. 2) Pour faciliter leur valorisation les sacs et les emballages doivent être fabriqués : - avec le minimum de matières premières, - de matières non composées et non toxiques, - de matières valorisables. 3) Les personnes qui commercialisent des produits emballés sont tenues de : - pourvoir elles-mêmes à la reprise et à la gestion des emballages utilisés des produits qu'elles mettent sur le marché selon les conditions fixées à l'article 6 du présent décret, - ou confier la prise en charge pour leur compte de cette obligation à des entreprises titulaires de l'autorisation et sur la base d'un contrat à conclure avec elles, - ou adhérer au système public de reprise et de valorisation des emballages utilisés créée conformément à l'article 8 du présent décret. 4) Les personnes assurent la gestion des systèmes de reprise et de valorisation des emballages utilisés, doivent : - établir un dispositif de consignation dont le signalement distinctif et le numéro de visa sont portés d'une manière apparente sur les emballages, - établir un système permettant la reprise des emballages utilisés, leur collecte et leur orientation vers les unités de réutilisation ou de valorisation qui dépendent d'elles ou avec lesquelles elles sont liées par un contrat, - pourvoir elles-mêmes à la réutilisation, ou à la valorisation desdits emballages. 5) Les systèmes de reprise et de valorisation sont soumis à l'autorisation du ministre chargé de l'environnement qui fixe leur signalement distinctif et le numéro de leur visa.",Decret_97_1102.pdf,
40,3,11.0,2,96-41,3,1996-06-10,49 / 1996, Gestion de déchets et leur élimination,"** Prévention et réduction de la production des déchets et de leur nocivité. - Article 4 : Valorisation des déchets par la réutilisation, le recyclage ou l’utilisation comme source d’énergie Réservation de décharges contrôlées pour le dépôt des déchets ultimes, soit après épuisement de toutes les possibilités de valorisation. Toute personne dont l’activité produit des déchets ou qui détient des déchets dans des conditions susceptibles des effets négatifs sur le sol, la flore ou la faune, de polluer l’air ou l’eau ou d’engendrer des nuisances sonores ou des odeurs et d’une manière générale de porter atteinte à l’environnement est tenue de les éliminer conformément aux dispositions de la présente loi. - Article 7 : L’incinération de déchets en plein air et leur utilisation comme combustibles sont interdites, à l’exception des déchets végétaux - Article 9 : Est mise à la charge du producteur, du distributeur ou du transporteur l'obligation de récupérer les déchets engendrés par les matières ou par les produits qu'ils produisent ou écoulent. Les autorités compétentes peuvent les obliger à éliminer ces déchets et le cas échéant, à participer à des systèmes de récupération et d'élimination des déchets provenant d'autres produits identiques ou similaires - Article 24 : La gestion des déchets doit s'effectuer sans causer un danger quelconque pour la santé de l'Homme, sans utiliser des modes ou des procédés pouvant nuire à l'environnement et notamment l'eau, l'air, le sol et les espèces de faune et de flore, sans provoquer des incommodités par le bruit ou les odeurs ou autres et sans porter atteinte aux paysages naturels et urbains. - Article 25 : Toute personne détenant des déchets est tenue de les livrer, conformément aux modalités déterminées par les autorités compétentes, à un organisme public ou privé chargé de la collecte ou à un établissement effectuant des opérations et de valorisation . - Article 33 : Un registre spécifique aux déchets dangereux est tenu et conservé pendant une période de dix ans. Cette période peut être prolongée par les règlements fixant les modalités de gestion de certaines catégories de déchets dangereux. - Article 34 : Les établissements et entreprises qui produisent, transportent ou gèrent les catégories de déchets visées à l'article 31 de la présente loi sont tenus de communiquer chaque année au ministère chargé de l'environnement toutes les informations sur les déchets qu'ils produisent, exportent ou gèrent, sur leurs origines, leurs quantités, leurs catactéristiques, leurs destinations et le mode de leur gestion, ainsi que sur les accidents qu'ils ont causé et les mesures pratiques prises pour limiter autant que possible la production de ces déchets. - Article 47 : Est puni d'un emprisonnement de deux mois à deux ans et d'une amende d'un montant de 100 à 50.000 dinars ou de l'une de ces deux peines seulement : d'établissements et d'entreprises agrées pour gérer cette catégorie de déchets, - toute personne ayant délibèrement éliminé des déchets dans des installations n'ayant pas obtenu l'autorisation visée à l'article 26 de la présente loi, - toute personne ayant délibèrement contrevenu aux dispositions des articles 13 et 14, - toute personne n'ayant pas fait parvenir les informations exigées dans l'article 34 de la présente loi à l'administration ou ayant fournit des informations erronées, - toute personne ayant délibèrement contrevenu aux conditions citées dans l'article 36 de la présente loi, relatives au conditionnement, au transport et à l'étiquetage de déchets dangereux, - toute personne ayant délibèrement contrevenu aux règlements mentionnés dans l'article 38 de la présente loi, relatifs à la limitation de la production de déchets dangereux, - toute personne ayant délibérement contrevenu aux réglements mentionnés dans l'article 41 de la présente loi.",Loi_96_41.pdf,
41,8,18.0,5,20-07-1989,3,1989-07-20,59 / 1989,Homologation de la norme tunisienne relative aux rejets d'effluents dans le milieu hydrique,"La norme visée à l'article premier du présent arrêté, est d'application obligatoire, sous réserves des dérogations prévus par l'article 6 de la loi sus-visée du 06 août 1982",Arrete_20_07_1989.pdf,
42,8,18.0,4,85-56,3,1985-01-02,6 / 1985,La réglementation relative des rejets dans le milieu récepteur (1985),"Toutes les eaux usées qui ne répondent pas aux normes de rejet dans le milieu récepteur, doivent être déversées dans les canalisations publiques conformément à la réglementation relative aux conditions de branchement et de déversement des effluents dans le réseau public d'assainissement. ------------------------------------------------------------ Toute exploitation soumise à autorisation doit effectuer des contrôles périodiques de ses rejets et tenir à cet effet un registre où sont consignés les dates et les résultats des analyses effectuées.",Decret_85_56.pdf,
43,8,18.0,4,2001-1534,3,2001-06-25,53,Fixation des conditions de raccordement aux réseaux publics d'assainissement dans les zones d'intervention,"Fixation des conditions de raccordement aux réseaux publics d'assainissement dans les zones d'intervention de l'office national de l'assainissement. 1) Le raccordement est subordonné à la signature par l'usager du cahier des charges prévu par la législation en vigueur relative aux conditions et aux modalités de déversement et rejet des eaux résiduaires, autres que domestiques, dans les réseaux d'assainissement implantés dans les zones d'intervention de l'office national de l'assainissement. 2) Les travaux de raccordement au réseau public d'assainissement sont effectués par l'office national de l'assainissement ou sous son contrôle aux frais de l'usager. Pour chaque demande de branchement, une facture est dressée par l'office national de l'assainissement. 3) Les frais de raccordement calculés sur la base d'un tarif unique appliqué à tous les usagers et fixé par arrêté du ministre de l'environnement et de l'aménagement du territoire. Ce tarif est réduit de 50% pour ce qui est des frais de raccordement des immeubles inscrits dans les projets présidentiels d'assainissement des quartiers populaires et dans les programmes de logements sociaux, conformément aux critères qui seront fixés par arrêté conjoint des ministres de l'équipement et de l'habitat et de l'environnement et de l'aménagement du territoire. 4) Le paiement des frais de raccordement est effectué soit au comptant, soit à tempérament, selon les modalités qui seront fixées par arrêté du ministre de l'environnement et de l'aménagement du territoire.",,
45,8,18.0,4,97-768,3,1979-09-08,54 / 1979,Règlement les conditions de branchement et de déversement des effluents dans le réseau public d'assainissement,"1) Ces dispositions sont applicables dans les périmètres communaux ou autres zones pourvues d'un service public d'assainissement. 2) Obligation de raccorder aux égouts publics existants pour l'évacuation des eaux usées et pluviales tout immeuble à usage d'habitation, ou à usage industriel, commercial, ou professionnel situé dans une voie pourvue d’égouts publics, ou dans une voie privée débouchant sur une telle voie. 3) Tout propriétaire d'un immeuble qui n'est pas branché aux égouts est tenu d'adresser aux services publics d’assainissement une demande établie pour demander le branchement aux égouts. 4) Il est interdit d'introduire dans l'égout, le branchement particulier ou les installations intérieures, tout objet, matériel, produit ou liquide qui peuvent obstruer les conduites, affecter l'atmosphère, émettre des vapeurs ou gaz toxiques inflammables ou explosifs, ou de quelque manière entraver le bon fonctionnement des égouts ou des autres ouvrages d'assainissement ou promettre l'hygiène ou la salubrité publique. 5) Tout déversement dans le réseau d’égouts publics, d'eaux résiduaires autres que domestiques doit être préalablement autorisé par le ministère de l'équipement. 6) Quand il survient, après octroi de l'autorisation, un changement de circonstances ou de connaissances, sur la base desquelles il devient prévisible que la continuation du déversement autorisé portera atteinte au fonctionnement des égouts ou des autres ouvrages d'assainissement, atteinte qui ne peut être obvié par d'autres prescriptions. 7) Les infractions à ces dispositions sont punies conformément aux dispositions des articles 158, 159 et 160 du code des eaux.",Decret_79_768.pdf,
46,49,124.0,2,97-37,2,1997-06-02,45 / 1997,Relative au transport par route des matières dangereuses,"1) Les matières dangereuses sont classées comme suit : - Classe 1 : Les matières et les objets explosifs ou explosibles - Classe 2 : Les gaz comprimés, liquéfiés ou dissous sous pression - Classe 3 : Les matières liquides inflammables - Classe 4 : (4.1) Les matières solides inflammables, (4.2 ) Les matières sujettes à l'inflammation spontanée et (4.3) Les matières qui, au contact de l'eau, dégagent des gaz inflammables - Classe 5 : (5.1) Les matières comburantes et (5.2) Les peroxydes organiques. - Classe 6 : (6.1) Les matières toxiques et (6.2) Les matières infectieuses - Classe 7 : Les matières radioactives - Classe 8 : Les matières corrosives. - Classe 9 : Les matières et les objets dangereux divers. 2) Les matières dangereuses autres que celles mentionnées par ces listes ne peuvent être transportées qu'après l'obtention d'une autorisation. 3) L'emballage des colis contenant des matières dangereuses doit être adapté à leur nature, aux dangers qu'elles peuvent provoquer et aux moyens utilisés pour leur chargement, leur transport et leur déchargement. 4) Aucun véhicule automobile , remorque ou autre engin ne peut être utilisé pour le transport , par route, des matières dangereuses que s'il répond aux règles techniques relatives à leur aménagement et à leur équipement . 5) Les matières dangereuses ne peuvent être transportées que si elles comportent les étiquettes de danger qui leurs sont propres. Les véhicules, les remorques et les autres engins utilisés pour leur transport doivent comporter les marques distinctives et les étiquettes appropriées indiquant le danger. 6) Le transport des matières dangereuses est soumis à l'assurance obligatoire pour la responsabilité civile résultant de leurs risques. 7) L'opération de transport de certaines matières dangereuses s'effectue obligatoirement sous le contrôle et par l'accompagnement des unités de sécurité chargées par le ministre de l'intérieur. 8) Les véhicules de transport des matières dangereuses sont soumis à des limitations de vitesse et à des conditions se rapportant à leur arrêt et à leur stationnement. 9) Toute matière dangereuse doit être munie, lors du transport, d'une fiche de sécurité comportant des consignes comportant les moyens de prévention contre ses risques. 10) Le transport de certaines matières dangereuses est soumis à l'obtention d'une feuille de route. 11) Tout conducteur d'un véhicule transportant des matières dangereuses doit avoir un certificat de formation et un certificat d'aptitude médicale. 12) Tout expéditeur d'une matière dangereuse doit respecter les règles se rapportant à son emballage, à son chargement, la signalisation adéquate qu'elle doit porter et aviser le transporteur de sa nature et de ses risques. 13) Tout transporteur d'une matière dangereuse doit délivrer au conducteur chargé de son transport la fiche de sécurité. 14) Il est interdit de transporter des personnes dans des véhicules destinés au transport des matières dangereuses. 15) Il est interdit aux conducteurs des véhicules destinés, même accessoirement au transport des matières dangereuses, à leurs convoyeurs et à tous les intervenants dans les opérations de transport de ces matières de fumer pendant l'accomplissement de leur travail, de conduire après avoir consommé des boissons alcoolisées ou pris des médicaments tranquillisants ou des matières susceptibles d'agir sur les aptitudes du conducteur. Ils doivent aussi respecter toutes les recommandations prévues par la fiche de sécurité et dont une copie doit être affichée dans la cabine de conduite. 16) Le transporteur doit nettoyer et assainir les véhicules et les engins directement après chaque opération de transport de matières dangereuses. Il en est dispensé lorsque le véhicule est rechargé de matières de même nature . En cas de retour à vide de véhicules sans qu'ils aient été nettoyés, ni assainis, les étiquettes et les marques distinctives de la matière qu'ils comportent, doivent être gardées. L'évacuation des eaux polluées provenant des opérations de nettoyage des véhicules doit être effectuée conformément aux conditions et aux normes prescrites par la législation et les règlements en vigueur. 17) Toutes infractions de ces dispositions entraînent des sanctions qui varient entre -une amende de 60 à 300 DT, -un emprisonnement d'un mois et une amende de 300 à 1000 DT, -un emprisonnement de 6 mois et une amende de 1000 à 3000 DT.",Loi_97_37.pdf,
47,49,124.0,4,2003-2069,2,2003-10-06,82 / 2003,La liste et la définition des matières dangereuses de la classe 3,"Fixant la liste et la définition des matières dangereuses de la classe 3 autorisées a être transportées par route et les conditions de leur emballage, chargement et déchargement. 1) Les matières dangereuses de la classe 3 sont identifiées par : * un numéro d'identification : Ce numéro est celui prévu dans les recommandations des nations unies relatives au transport des marchandises dangereuses, * le nom de la matières selon l'une des rubriques définies au paragraphe 22 de l'article premier du présent décret, * un code de classification, * des étiquettes de danger, * un numéro d'identification du danger. 2) La classe 3 couvre les matières et objets contenant des matières de cette classe, qui : - sont liquides selon la définition mentionnée à l'article premier du présent décret, - ont, à 50 °C, une tension de vapeur d'au plus 300 kPa (3 bar) et ne sont pas complètement gazeuses à 20 °C et à la pression standard de 101,3 kPa, - ont un point d'éclair d'au plus 61 °C. Elle couvre aussi: - les matières liquides et les matières solides à l'état fondu dont le point d'éclair est supérieur à 61 °C et qui sont remises au transport ou transportées à chaud à une température égale ou supérieure à leur point d'éclair. Ces matières sont affectées au numéro d'identification 3256. - les matières explosibles désensibilisées liquides. Ces matières sont des matières explosibles liquides qui sont mises en solution ou en suspension dans l'eau ou dans d'autres liquides de manière à former un mélange liquide homogène n'ayant plus de propriétés explosives. Ces rubriques, au tableau figurant à l'annexe A (partie n° 1) du présent décret, sont désignées par les numéros d'identifications suivants : 1204, 2059, 3064, 3343 et 3357. 3) Les matières non toxiques et non corrosives ayant un point d'éclair supérieur à 35 °C qui, dans les conditions d'épreuves prescrites, n'entretiennent pas la combustion ne sont pas des matières de la classe 3, si ces matières sont cependant remises au transport et transportées à chaud à des températures égales ou supérieures à leur point d'éclair, elles sont des matières de la présente classe. 4) Par dérogation à l'article 3 du présent décret, le carburant diesel, le gazole et l'huile de chauffe (légère) ayant un point d'éclair supérieur à 61 °C, sans dépasser 100 °C, sont considérés comme des matières de la classe 3, ayant le numéro d'identification 1202. Les matières liquides très toxiques à l'inhalation, dont le point d'éclair est inférieur à 23 °C et les matières toxiques dont le point d'éclair est égal ou supérieur à 23° C sont des matières de la division 6.1. Les matières et préparations liquides inflammables, employées comme pesticides, qui sont très toxiques, toxiques ou faiblement toxiques et dont le point d'éclair est égal ou supérieur à 23 °C, sont des matières de la division 6.1. 5) Les matières dangereuses de la classe 3 sont affectées à trois groupes d'emballage, selon le degré de danger qu'elles présentent : - groupe d'emballage I : matières très dangereuses, - groupe d'emballage II : matières moyennement dangereuses, - groupe d'emballage III : matières faiblement dangereuses. 6) A l'arrivée aux lieux de chargement et de déchargement, le véhicule et son conducteur doivent satisfaire aux dispositions réglementaires, notamment en ce qui concerne la sécurité, la propreté et le bon fonctionnement des équipements du véhicule utilisés lors du chargement et du déchargement. Le chargement ne doit pas être effectué s'il s'avère, par un contrôle des documents et un examen visuel du véhicule et de ses équipements, que le véhicule ou le conducteur ne satisfont pas aux dispositions réglementaires. Le déchargement ne doit pas être effectué si les mêmes contrôles indiqués ci-dessus montrent des manquements qui peuvent mettre en cause la sécurité du déchargement. 7) Le chargement et le transport de matières dangereuses dans des citernes en matière plastique renforcée de fibres n'est autorisé que si les conditions suivantes sont réunies : a) la matière appartient à la classe 3, b) la pression de vapeur maximale (pression absolue) à 50 °C de la matière ne dépasse pas 110 kPa (1,1 bar), c) le chargement et le transport de la matière dans des citernes métalliques est expressément autorisé conformément à l'article 60 du présent décret, d) la pression de calcul indiquée pour cette matière dans la deuxième partie du code citerne dans la colonne n° 12 du tableau figurant à l'annexe A (partie n° 1) du présent décret ne dépasse pas 4 bar, et e) la citerne est conforme aux dispositions de construction en vigueur et applicables au transport de la matière. La température de la matière transportée ne doit pas dépasser, au moment du remplissage, la température de service maximale.",Decret_2003_2069.pdf,
48,2,19.0,4,2005-3079,2,2005-11-29,97 / 2005,La liste des matières dangereuses qui sont transportées par route obligatoirement sous le contrôle,"Fixant la liste des matières dangereuses qui sont transportées par route obligatoirement sous le contrôle et avec l'accompagnement des unités de sécurité. Les matières dangereuses qui sont transportées par route obligatoirement sous le contrôle et avec l'accompagnement des unités de sécurité sont : 1- les matières et objets explosifs et explosibles de la classe 1, 2- les matières radioactives de la classe 7 dont l’activité dépasse 3,7 multiplié par 10 puissance 10 (10 exp 10) kilobecquerel (kBq) (l'équivalent de 1000 curies) 3- les matières corrosives de la classe 8 figurant au tableau annexé au présent décret, et ce, lorsque la quantité transportée de la ou des matières figurant au tableau précité dépasse 500 kg.",Decret_2005_3079.pdf,
49,49,124.0,4,2002-2015,2,2002-09-04,74 / 2002,Les règles techniques relatives à l'équipement et à l'aménagement des véhicules utilisés pour le transport ,"Fixant les règles techniques relatives à l'équipement et à l'aménagement des véhicules utilisés pour le transport des matières dangereuses par route. 1) Toute unité de transport chargée de matières dangereuses doit être munie : - d’au moins deux extincteurs d’incendie, - d’un moyen de communication adapté. - d’une boite de premiers secours d’urgence ; - d’une trousse d'outils pour les réparations de fortune du véhicule; - d’une cale au moins, par véhicule, de dimensions appropriées au poids du véhicule et au diamètre des roues; - des équipements nécessaires pour prendre les mesures d’ordre général indiquées dans la fiche de sécurité, notamment : *deux signaux d’avertissement autoporteurs ( cônes ou triangles réfléchissants ou feux clignotants oranges indépendants de l'installation électrique du véhicule ), *un ruban de balisage ; * un vêtement fluorescent approprié pour chaque membre de l’équipage du véhicule. *une lampe de poche antidéflagrant pour chaque membre de l’équipage du véhicule; -des équipements nécessaires pour prendre les mesures supplémentaires et spéciales indiquées dans la fiche de sécurité. 2) Si des matières toxiques sont transportées ,chaque membre de l’équipage du véhicule doit être muni d’une protection respiratoire permettant d’intervenir ou de quitter les lieux sans être atteint par les émanations dangereuses en cas d'urgence. 3) Les véhicules transportant des matières radioactives doivent, en outre, être équipés d’un détecteur de radiation ionisante. 4) Le certificat de visite technique des véhicules précités doit porter la mention ‘’ véhicule de transport de matières dangereuses, type….’’ .",Decret_2002_2015.pdf,
50,49,124.0,4,2004-828,2,2004-03-29,27 / 2004,La liste et la définition des matières dangereuses de la classe 8 ,"Fixant la liste et la définition des matières dangereuses de la classe 8 autorisées à être transportées par route et les conditions de leur emballage, chargement et déchargement. Les matières dangereuses de la classe 8 sont identifiées par : - Un numéro d'identification, Ce numéro est celui prévu dans les recommandations des nations unies relatives au transport des marchandises dangereuses - Le nom de la matière selon l'une des rubriques défies au paragraphe 24 de l'article premier du présent décret - Un code de classification - Des étiquettes de danger - Un numéro d'identification du danger - La classe 8 couvre les matières et les objets contenant des matières de cette classe qui, par leur action chimique, attaquent le tissu épithélial de la peau et des muqueuses avec lequel elles sont en contact ou qui peuvent causer des dommages à d'autres matières ou moyens de transport, les détruire ou créer d'autres dangers. - Lorsque les matières de la classe 8, par suite d'adjonctions, passent dans d'autres catégories de danger, elles doivent être affectées aux rubriques correspondant à leur danger réel. Chapitre 4 : Conditions de chargement et de déchargement A l'arrivée aux lieux de chargement et de déchargement, le véhicule et son conducteur doivent satisfaire aux dispositions réglementaires, notamment en ce qui concerne la sécurité, la propreté et le bon fonctionnement des équipements du véhicules utilisés lors du chargement et du déchargement. Le chargement ne doit pas être effectué s'il s'avère par un contrôle des documents et un examen visuel du véhicule et de ses équipements que le véhicule ou le conducteur ne satisfont pas aux dispositions réglementaires. Le déchargement ne doit pas être effectué si les mêmes contrôles indiqués ci-dessus montrent des manquements qui peuvent mettre en cause la sécurité du déchargement.",Decret_2004_828.pdf,
51,52,7.0,2,94-28,2,1994-02-21,15,Régime de réparation des préjudices résultant des accidents du travail et des maladies professionnelles,"1) Il est institué un régime de réparation des préjudices résultant des accidents du travail et des maladies professionnelles au profit des victimes ou de leurs ayants droit. 2) Cette loi est applicable à tous les travailleurs ou assimilés employés par des personnes physiques ou morales sous quelque forme que ce soit et quelle que soit la nature de l'activité, le statut du travailleur ou son mode de rémunération. Elle est également applicable aux :- stagiaires ;- apprentis ; - élèves des établissements d'enseignement technique ou professionnel, quels qu'en soient la spécialité ou le degré, si l'accident du travail est directement rattaché aux programmes d'enseignement ou de formation ; - les détenus pour les accidents survenus par le fait ou à l'occasion de travaux exécutés dans le cadre d'une utilisation régulière de la main d'oeuvre pénitentiaire ; - les travailleurs des chantiers nationaux ou régionaux de développement ; - les gens de maison. 3) Toute personne physique ou morale employant des personnes est tenue de s'affilier à la Caisse Nationale pour couvrir tous les agents employés chez elle contre les risques engendrés par les accidents du travail et les maladies professionnelles. Sont dispensés de droit, de l'obligation d'affiliation à la Caisse Nationale, l'Etat, les collectivités locales et les établissements publics à caractère administratif. 4) Les employeurs sont tenus de déclarer leurs travailleurs trimestriellement. La déclaration doit être nominative et conforme aux modalités fixées par arrêté du Ministre des Affaires Sociales. 5) Tout employeur affilié au régime prévu par la cette loi est tenu de payer une cotisation à la caisse nationale. 6) Les victimes des accidents du travail et des maladies professionnelles ont droit: - à la prestation des soins que requiert leur état ; - à une indemnité journalière pour perte de salaires ; - lorsqu'il subsiste, après guérison, une incapacité de travail permanente, la prestation des appareils de prothèse ou d'orthopédie nécessaires, s'il y a lieu, et si l'incapacité le justifie, et une réparation en espèces sous forme d'une rente réversible aux ayants droit en cas de décès de la victime. - lorsque l'accident est suivi de mort, il est versé à ses ayants droit une somme forfaitaire à titre de frais funéraires. 7) Aucune indemnité ne peut être attribuée à la victime qui a intentionnellement provoqué l'accident. 8) La victime d'un accident du travail est maintenue dans la même catégorie professionnelle qu'il occupait avant l'accident , lorsque son incapacité partielle permanente ne l'empêche pas d'exercer normalement son travail . 9) En cas d'incapacité temporaire de travail consécutive à l'accident, la victime a droit à une indemnité journalière, sans distinction entre les jours ouvrables et les jours de repos hebdomadaires ou les jours fériés. 10) L'indemnité journalière est due jusqu'au jour de la guérison totale de la victime ou de la preuve qu'elle est atteinte d'une incapacité permanente ou de son décès. 11) Les victimes d'accidents du travail atteintes d'une incapacité permanente de travail, quel qu'en soit le taux, ont droit à la fourniture, à la réparation et au renouvellement des appareils orthopédiques et de prothèse , qui peuvent leur être nécessaires en raison de leur état de santé, ainsi qu'à la réparation et au remplacement des appareils utilisés avant l'accident et que celui-ci a rendu inutilisables. 12) Lorsque l'accident est suivi du décès du travailleur, il est servi aux ayants droit une indemnité de frais funéraires équivalente au salaire d'un mois. Le montant de cette indemnité ne peut être inférieur au salaire minimum interprofessionnel garanti en vigueur correspondant à une durée de travail de 200 heures. 13) Les rentes dues aux victimes atteintes d'une incapacité permanente du travail ou, en cas de décès, à leurs ayants-droit, sont calculées par référence aux salaires les plus élevés perçus par la victime au titre de l'un des quatre trimestres précédents l'accident ou la maladie professionnelle, multipliés par quatre, ou à la moyenne des salaires perçus au cours de l'année précédent la survenance de l'accident, selon que l'une ou l'autre des deux formules est la plus favorable. 14) La victime d'un accident du travail, quelle que soit sa gravité, doit, dans la journée ou au plus tard dans les quarante huit heures ouvrables suivant la survenance de l'accident, en informer ou en faire informer l'employeur ou l'un de ses préposés, sauf cas de force majeure, d'impossibilité absolue ou de motifs légitimes. 15) En cas de maladie professionnelle, le travailleur doit en informer le dernier employeur chez qui il a effectué des travaux susceptibles d'engendrer la maladie ou, en cas d'empêchement, la Caisse Nationale, et ce dans un délai de 5 jours à compter de la date de la première constatation médicale de la maladie. 16) De quelque façon que l'employeur ait eu connaissance de l'accident ou de la maladie, il doit en faire la déclaration même si la victime a continué à travailler, et ce dans les trois jours ouvrables suivants l'avis qui lui en a été donné. Cette déclaration doit être établie en trois exemplaires et transmise : - à la Caisse Nationale de Sécurité Sociale ; - au poste de police ou de la garde nationale le plus proche du lieu de l'accident ou du lieu de travail de la victime ; - à l'inspection du travail territorialement compétente. 17) Dès réception de la déclaration d'accident ou de maladie, la Caisse Nationale doit prendre en charge les soins et les prothèses nécessités par l'état de santé de la victime et servir les indemnités sur la base des salaires qui lui sont déclarés. 18) Par dérogation aux dispositions des articles 42 à 46 et 49 à 59 de la présente loi, les bénéficiaires d'indemnités permanentes, individuellement ou ensemble, l'employeur ou la Caisse Nationale, après la survenance de l'accident ou l'apparition de la maladie, après achèvement des soins nécessaires et détermination définitive du taux d'incapacité permanente, et à l'expiration du délai de révision, peuvent convenir à l'amiable de servir l'indemnisation sous forme de capital à la victime ou à ses ayants-droit, si le taux de l'incapacité permanente est inférieure ou égal à 35%. 19) Il est institué une carte de priorité en faveur des victimes d'accidents du travail ou de maladies professionnelles remplissant les conditions suivantes: - Etre atteintes, soit d'infirmités ou de déficiences fonctionnelles rendant la station debout pénible, soit d'infirmités ou de déficiences fonctionnelles nécessitant l'aide d'une tierce personne. - Etre titulaire, en raison des infirmités ou des déficiences décrites au paragraphe premier, soit d'une rente, soit d'une allocation servies en vertu de la législation tunisienne sur les accidents du travail et les maladies professionnelles. 22) Tout employeur assujetti au régime institué par la présente loi doit afficher dans chacun de ses établissements un résumé de la présente loi dont le modèle est fixé par arrêté du Ministre des Affaires Sociales. 23) Le non respect de cette loi est puni et les sanctions varient selon les contraventions. La violation des normes d'hygiène et de sécurité du travail, et la non application des mesures de prévention recommandées par les Services compétents, sont sanctionnées conformément aux dispositions du Code du Travail. Les sanctions prévues par ce titre n'excluent pas l'application de toute sanction pénale ou administrative énoncée par d'autres textes. 24) Les accidents du travail survenus avant la date d'entrée en vigueur de la présente loi et les maladies professionnelles constatées pour la première fois avant cette date ouvrent droit, quelle que soit la date du règlement de leurs suites par voie d'accord ou par décision judiciaire, aux indemnités fixées par la législation et la réglementation en vigueur au moment de l'accident ou de la première constatation de la maladie. - Art 85 : L'employeur est tenu de prendre toutes les mesures préventives adéquates qui sont nécessitées par la nature de son activité. Tout employeur, dont les procédés du travail sont susceptibles de provoquer les maladies professionnelles visées à l'article 3 de la présente loi, doit en faire la déclaration, dans le délai d'un mois à partir de la date de leur utilisation, à la Caisse Nationale qui en avise les organismes concernés par l'inspection médicale du travail et la prévention des risques professionnels. Tout employeur qui cesse d'employer des procédés de travail susceptibles de provoquer les mêmes maladies, doit en faire la déclaration conformément aux mêmes procédures. La forme des déclarations visées par le présent article est fixée par arrêté du Ministre des Affaires Sociales. - Art. 87 : Tout médecin qui, dans l'exercice de ses fonctions, constate une atteinte d'une maladie professionnelle, qu'elle figure ou non sur la liste des maladies professionnelles, est tenu d'en faire la déclaration en précisant la nature de l'agent nocif à l'action duquel la maladie est attribuée et la profession du malade. Cette obligation incombe aussi et particulièrement aux médecins de l'entreprise. Cette déclaration est adressée, dans tous les cas, au médecin inspecteur du travail territorialement compétent. - Art 93 : Tout employeur assujetti au régime institué par la présente loi doit afficher dans chacun de ses établissements un résumé de la présente loi dont le modèle est fixé par arrêté du Ministre des Affaires Sociales. Cet arrêté fixe également les cas de dispense de l'affichage de ce résumé.",94_28.pdf,
52,52,7.0,2,95-103,2,1995-11-27,96 / 1995,La réparation des accidents du travail et des maladies professionnelles,"Les employeurs régis par les dispositions de la présente loi sont tenus de s'affilier à la caisse nationale. Ils doivent aussi lui déclarer les travailleurs nouvellement recrutés, à quel que titre que ce soit, et ce dans un délai n'excédant pas quarante huit heures ouvrables à partir de la date de recrutement. Cette affiliation prend effet à compter de la date de commencement effectif du travail. La déclaration est faite conformément à un modèle fixé par arrêté du ministre des affaires sociales.",Loi_95_103.pdf,
53,52,7.0,5,10-01-1995,2,1995-01-10,26 / 1995,Le barème indicatif des taux d'invalidité permanente résultant des AT/MP,- La liste des maladies professionnelles est fixée conformément aux tableaux annexés à l'arrêté.,Arrete_10_01_1995.pdf,
54,52,7.0,5,13-01-1995,2,1995-01-13,26 / 1995,La formule de la déclaration de procédés du travail pouvant provoquer des maladies professionnelles ,Fixant la formule de la déclaration de procédés du travail pouvant provoquer des maladies professionnelles ou la cessation de leur utilisation. La formule de la déclaration de procédés du travail pouvant provoquer des maladies professionnelles ou la cessation de leur utilisation est fixée conformément aux tableaux annexés à l'arrêté.,Arrete_13_01_1995-0.pdf,
55,52,7.0,5,23-02-1995,2,1995-02-23,26 / 1995,La formule de la déclaration des accidents du travail et des maladies professionnelles,La formule de la déclaration des accidents du travail et des maladies professionnelles est fixée conformément aux tableaux annexés à l'arrêté.,Arrete_23_02_1995-0.pdf,
56,52,7.0,5,05-06-2003,2,2003-06-05,47 / 2003,La liste des maladies professionnelles 03,"La liste des maladies professionnelles prévue par l'article 3 de la loi n° 94-28 du 21 février 1994 est amendée et complétée par les tableaux n° 4, 14, 15, 17, 18, 31, 80 et 82 annexés au présent arrêté.",Arrete_05_06_2003-0.pdf,
59,52,7.0,5,15-08-2007,2,2007-08-15,69 / 2007,La liste des maladies professionnelles 07,"La liste des maladies professionnelles prévue par l’article 3 de la loi n° 94-28 du 21 février 1994 susvisée est amendée et complétée par les tableaux n° 6, 7, 28, 44, 56, 58, 59, 75, 80 et 82 annexés à l'arrêté.",15_08_2007.pdf,
60,52,7.0,5,21-12-1994,2,1994-12-21,01 / 1995,Réglementant le contenu du résumé de la loi n° 94-28 du 21 février 1994,"Réglementant le contenu du résumé de la loi n° 94-28 du 21 février 1994 relative au régime de réparation des préjudices résultant des accidents du travail et des maladies professionnelles. 1) Est déterminé conformément au modèle publié en annexe de l'arrêté, le résumé de la loi, dont l'affichage est prescrit dans chacun des établissements assujettis au régimes prévu par la loi susvisée n° 94-28 du 21 février 1994. 2) Sont dispensés de l'obligation d'afficher le modèle visé sur les lieux du travail, les employeurs exerçant dans les secteurs ci-après : - le secteur agricole - le secteur des mines, des carrières et des industries extractives des matières premières, - le secteur de production forestière telle que l'abattage, les coupes de bois, la récolte de liège et similaires, - tous les moyens de transport à l'exception des navires, - tous les lieux du travail où l'affichage de résumé s'avère impossible à condition que la dispense soit accordée par l'inspection du travail territorialement compétente. Au cas où ces établissements disposent d'un siège social et d'une représentation administrative, le modèle visé doit y être affiché.",Arrete_21_12_1994_1.pdf,
62,47,113.0,1,2009-11,2,2009-03-02,19 / 2009,Promulgation du code de la sécurité et de la prévention des risques ,"Les règles de sécurité et de prévention des risques d’incendie, d’explosion et de panique diffèrent selon le type de bâtiment, la nature de l’activité qui y est exercée et sa capacité d’accueil. - Article 8 : Les exploitants des bâtiments, régis par les dispositions du présent code, doivent tenir un livre de sécurité afférent au bâtiment. - Article 9 : Les propriétaires des bâtiments abritant des établissements dangereux, insalubres ou incommodes, sont tenus d’établir un plan intérieur d’intervention afférent auxdits bâtiments. - Article 10 : Les exploitants des bâtiments abritant des établissements dangereux, insalubres ou incommodes, sont tenus de mettre en place une équipe de sécurité qui assure des missions relatives à la sécurité et à la prévention des risques d’incendie, d’explosion et de panique - Article 12 : Les entrepreneurs d’équipement des bâtiments, régis par les dispositions du présent code, à l’étape de la construction, et leurs exploitants, à l’étape de l'exploitation, sont tenus d’assurer la bonne exécution, exploitation et maintenance des réseaux techniques et des équipements installés dans le bâtiment et leur conformité aux prescriptions des règlements de sécurité. - Article 43 : Les bâtiments, abritant des établissements dangereux, insalubres ou incommodes, sont classés conformément à la législation en vigueur. - Article 46 : Il est interdit aux exploitants des différents types de bâtiments, régis par les dispositions du présent code, de les exploiter partiellement ou totalement avant ou sans l'obtention auprès des services de la protection civile d'une attestation de prévention attestant que toutes les règles et mesures de sécurité et de prévention des risques d'incendie, d'explosion et de panique ont été appliquées au bâtiment.",Loi_2009_11.pdf,
63,1,20.0,4,2006-2687,2,2006-10-09,83 / 2006,"Procédures d’ouverture et d’exploitation des établissements dangereux, insalubres ou incommodes ","Le texte précise les procédures d’ouverture et d’exploitation des établissements classés, notamment la constitution du dossier de demande d’ouverture ou de régularisation et la taxe initiale à payer. Pour les établissements de catégorie 1 et 2, une étude des dangers et une étude d’impact sont indispensables. De même qu’un Plan d'Opération Interne avant le démarrage. Le délai limite de régularisation des dossiers des établissements en cours d’exploitation est fixé au 31 décembre 2007. * Obligations d’avoir une autorisation d’exploitation auprès de ministère de l’industrie et de l’énergies et PME * Un dossier devra être déposé au gouvernorat de Sfax qui comporte les pièces suivantes : - Une étude de dangers en quatre exemplaires exposant les éventuels dangers et fixant les mesures et les moyens de prévention contre les risques d’incendie, d’explosion, de panique et des accidents industriels majeurs. L’étude des dangers est réalisée sous la responsabilité de l’exploitant et doit contenir les éléments indispensables pour l’élaboration d’un plan d’opération interne qui doit être achevé au commencement de l’exploitation de l’établissement, - Une étude d'impact environnement en 2 exemplaires - Une note relative à la maîtrise des exigences d’hygiène, de santé et de sécurité - Un plan de masse à l'échelle 1/1000 - Un extrait de la carte de Tunisie à l’échelle 1/25000 ou 1/50000 - un récépissé du mondât postal de 50 dt au nom du receveur économe de l'imprimerie officielle - Un récépissé du mandat de 50 dt de versement du droit fixe exigible au titre de l’ouverture d'un établissement classé au profit de la Trésorerie Générale.",Decret_2006_2687.pdf,
64,1,20.0,5,15-11-2005,2,2005-11-15,94 / 2005,"La nomenclature des établissements dangereux, insalubres ou incommodes","Article 1 : Les établissements dangereux, insalubres ou incommodes sont classés dans les différentes catégories prévues à l'article 294 du code de travail conformément à la nomenclature annexée au présent arrêté. Article 2 : Les établissements classés autorisés avant la publication de ce présent arrêté dans une catégorie inférieure devront régulariser leur situation juridique conformément au décret n°68-88 du 28 Mars 1968 au plus tard dans les cinq ans qui suivent son entrée en vigueur.",Arrete_15_11_2005.pdf,
65,1,20.0,5,20-02-2010,2,2010-02-20,17 / 2010,Les termes de référence de l'étude de dangers et du plan d'opération interne relatives aux établissements,"- Article premier : Le présent arrêté fixe les termes de référence de l'étude de dangers et du plan d'opération interne qui doivent être annexés à la demande d'ouverture d'un établissement classé de première et deuxième catégorie, et ce, conformément à l'article 3 du décret n°2006-2687 du 9 octobre 2006. - Article 4 : L'étude de dangers doit exposer les risques éventuels générés par l'activité de l'établissement y compris l'analyse et l'évaluation des ces risques. Elle doit présenter une description détaillée des accidents pouvant survenir et leurs causes internes ou externes ainsi qu'une description détaillée de la nature, de la typologie et de l'étendue des effets que peut engendrer tout éventuel accident. L'étude de dangers doit être appuyée par les plans, les plans descriptifs, les paragraphes de calcul nécessaires et par des scénarios clairs et précis. L'étude de dangers doit exposer et justifier les mesures préventives et les démarches que l'exploitant prendra sous sa responsabilité pour réduire la probabilité d'occurrence des accidents et limiter leurs éventuelles conséquences sur les personnes, les biens et l'environnement. - Article 5 : L'étude de dangers doit prendre en considération toutes les composantes de l'établissement et ses équipements, y compris : - la conception des installations et des équipements, - la nature, les quantités et les caractéristiques des matières dangereuses utilisées, - les méthodes d'exploitation et les modes de production, - les méthodes et les procédures de contrôle et de commande, - la formation des employés et l'organisation de l'établissement en matière de sécurité. L'étude de dangers doit prendre en compte également les causes des accidents susceptibles de survenir qu'elles soient internes ou externes tels que les séismes et les inondations en plus des facteurs et des dangers qui peuvent résulter des réseaux et des établissements dangereux voisins, les services et les infrastructures proches tels que les routes importantes, les voies ferrées, les cours d'eau, les ports, les aéroports et autres. - Article 7 : Le plan d'opération interne doit définir également les ressources et les moyens matériels et humains nécessaires pour faire face auxdits accidents. - Article 8 : Le plan d'opération interne doit être achevé et visé par la direction de la sécurité du ministère de l'industrie et de la technologie ainsi que l'office national de la protection civile, et ce, avant le démarrage de l'exploitation de l'établissement. - Article 9 : Les établissements classés de première catégorie doivent réaliser au moins un exercice à blanc par an du plan d'opération interne et ce, en coordination avec les services de la direction de la sécurité au ministère de l'industrie et de la technologie et l'office national de la protection civile. - Article 9 : Les établissements classés de première catégorie doivent réaliser au moins un exercice à blanc par an du plan d'opération interne et ce, en coordination avec les services de la direction de la sécurité au ministère de l'industrie et de la technologie et l'office national de la protection civile. - Article 11 : Le plan d'opération interne doit inclure au moins une analyse détaillée des éléments suivants : 1. description générale de l'établissement et de son fonctionnement, 2. nom, fonction et adresse du responsable de sécurité et de l'exécution du plan d'opération interne, 3. liste des membres de l'équipe de sécurité, leurs compétences et leurs adresses, 4. organisation de l'établissement pendant les accidents et répartition des missions, 5. schéma de l'alarme et de l'alerte, 6. les scénarios des principaux accidents possibles et les besoins pour y faire face en termes de moyens matériels et humains et les mesures de sécurité et de protection, 7. inventaire des moyens d'extinction des incendies et de lutte contre les accidents, les outils de secours et leurs emplacements, 8. Formation et qualification spécialisées dans le domaine de la sécurité, 9. programmes des exercices à blancs périodiques.",Arrete_20_02_2010.pdf,
66,1,20.0,5,23-02-2010,2,2010-02-23,18 / 2010," Mise à jour de la nomenclature des établissements dangereux, insalubres ou incommodes ","- Article premier : La nomenclature des établissements dangereux, insalubres ou incommodes fixée par l'arrêté susvisé du 15 novembre 2005 est modifiée conformément l'annexe l du présent arrêté.",Arrete_23_02_2010.pdf,
67,1,20.0,5,25-01-2012,2,2012-01-25,09 / 2012,"Modifiant et complétant l'arrêté du ministére de l'industrie, de l'énergie et des petites et moyennes entreprises","- Article premier : La nomenclature des établissements dangereux, insalubres ou incommodes fixée par l'arrêté du 15 novembre 2005 susvisé est modifiée conformément à l'annexe 1 du présent arrêté.",25_01_2012.pdf,
68,1,20.0,5,24-10-2012,2,2012-10-24,88 / 2012,"Mise à jour de la nomenclature des établissements dangereux, insalubres ou incommodes.","- Article premier : La nomenclature des établissements dangereux, insalubres ou incommodes fixée par l'arrêté susvisé du 15 novembre 2005 est modifiée conformément l'annexe l du présent arrêté. - Article 2 : La nomenclature des établissements dangereux, insalubres ou incommodes fixée par l'arrêté susvisé du 15 novembre 2005 est complétée conformément l'annexe 2 du présent arrêté.",24_10_2012.pdf,
69,47,113.0,5,16-09-2013,2,2013-09-16,79 / 2013,Attestation de prévention,"Arrêté du ministre de l'intérieur du 16 septembre 2013 fixant les documents constituant le dossier d'obtention de l'attestation de prévention ou de son renouvellement ainsi que le modèle de ladite attestation et du livre y réservé. - Article 1 : Le présent arrêté définit les documents constituant le dossier d'obtention de l'attestation de prévention ou de son renouvellement ainsi que le modèle de ladite attestation et le livre y réservé Article 2 - Pour l'obtention de l'attestation de prévention, l'exploitant du bâtiment doit soumettre un dossier auprès du siège de la direction régionale de la protection civile ou du siège de la brigade de la protection civile dans la circonscription territoriale de laquelle se situe le bâtiment, contre récépissé.",16_09_2013.pdf,
70,47,113.0,5,16-09-2013,2,2013-09-16,79 / 2013,Registre de sécurité,- Article 1 : Le présent arrêté fixe le contenu et la forme du registre de sécurité conformément au modèle y annexé Toute entreprise doit tenir à jour un registre de sécurité selon le modèle conformément à l’annexe 1.,registre_de_securite_AR.pdf,
71,47,113.0,5,16-09-2013,2,2013-09-16,79 / 2013,Composition de l’équipe de sécurité,"Arrêté du ministre de l'intérieur du 16 septembre 2013 fixant la composition de l’équipe de sécurité, ses attributions, les conditions de sa mise en place dans les bâtiments ainsi que les conditions devant être remplies par les individus habilités à en faire partie. - Article 1 : Le présent arrêté fixe la composition de l'équipe de sécurité qui doit être mise en place dans les bâtiments recevant du public à l'exception de la catégorie n° 5, dans les bâtiments à hauteur élevée et dans les bâtiments abritant des établissements dangereux, insalubre ou incommode, et définit ses attributions, les conditions de sa mise en place dans les bâtiments ainsi que les conditions devant être remplies par les individus habilités à en faire partie - Article 2 : L'équipe de sécurité est composée de : * Responsable de la sécurité du bâtiment. * Chefs d'équipe de sécurité. * Agents de sécurité. Le nombre des personnes composant l'équipe de sécurité est déterminé conformément aux prescriptions du règlement de sécurité propre à chaque type de bâtiment.",Arrete2013_1593_Equip_sec.pdf,
72,47,113.0,5,25-09-2013,2,2013-09-25,79 / 2013,Montant de la redevance de l'attestation de prévention,"- Article 1 : Le présent arrêté fixe le montant de la redevance exigible à la délivrance de l’attestation de prévention : 1. Bâtiments abritant des établissements dangereux, insalubres ou incommodes. - 1 ére catégorie : 150 DT - 2 ème catégorie : 100 DT - 3 ème catégorie : 20 DT 2. Bâtiments recevant du public : - 1 ére catégorie : 100 DT - 2 ème catégorie : 50 DT - 3 ème catégorie : 50 DT - 4 ème et 5 ème catégorie : 20 DT 3.Bâtiments à usage d’habitation : * Troisième type : 20 DT * Quatrième type : 20 DT 4. Bâtiments à hauteur élevée : * Premier type : 50 * Deuxième type : 100 * Troisième type : 50 * Quatrième type : 50 * Cinquième type : 50 * Sixième type : 50 * Septième type : 100",25_09_2013.pdf,
73,47,113.0,5,28-03-2014,2,2014-03-28,28 / 2014,Procédures d'avis aux services de la protection civile des travaux non soumis au permis de bâtir.,"Arrêté du ministre de l'intérieur et du ministre de l'équipement, de l'aménagement du territoire et du développement durable du 28 mars 2014, fixant les cas et procédures d'avis aux services de la protection civile des travaux non soumis au permis de bâtir. - Article 1 : Le présent arrêté définit les cas et les procédures d'avis aux services de la protection civile, des travaux ne nécessitant pas l'obtention d'un permis de bâtir selon la législation en vigueur, et qui sont de nature à être soumis aux mesures de sécurité et de prévention des risques d'incendie, d'explosion et de panique - Article 2 : Les travaux, ne nécessitant pas l'obtention d'un permis de bâtir, et qui sont de nature à être soumis aux mesures de sécurité et de prévention des risques d'incendie, d'explosion et de panique, sont définis comme suit : Exigence(s) : 1. Travaux visant à apporter des modifications à une construction existante, consistant à : ? L'installation des équipements de chauffage central. ? La pose d'installations électriques à l'intérieur des constructions ou dans les jardins, ? La pose des conduites de gaz à l'intérieur des constructions ou dans les jardins. 2. Travaux visant à apporter des réparations à une construction existante, consistant à : ? La réfection des planchers, ? La réfection des sols et des revêtements muraux, ? La réfection des installations électriques, ? La réfection des installations de gaz. Article 3 - Les propriétaires des bâtiments à usage d'habitation ou recevant du public, des immeubles à hauteur élevée et des bâtiments abritant des établissements dangereux, insalubres ou incommodes ? Une fiche de renseignement à retirer du siège de la direction régionale de la protection civile ou du siège de la brigade de la protection civile concernée, conformément au modèle annexé au présent arrêté (1), , doivent avant d'entamer l'un des travaux cités à l'article 2 du présent arrêté, déposer un dossier contre récépissé auprès des services de la protection civile dans la circonscription territoriale desquels se situe le bâtiment, contenant les pièces suivantes : ? Une copie de la carte d'identité nationale du propriétaire du bâtiment s'il est une personne physique ou du représentant légal s'il s'agit d'une personne morale, ? Un extrait de la publication légale au Journal Officiel de la République Tunisienne des statuts de la personne morale.",28_03_2014.pdf,
75,1,20.0,6,294,2,1966-04-30,code de travail,"Classification des établissements dangereux, insalubres ou incommodes","- Article n° 294 : Les établissements sont classés en trois catégories, suivant les dangers ou la gravité des inconvénients inhérents à leur exploitation. La première catégorie comprend les établissements qui doivent être éloignés des centres urbains et des habitations particulières. La deuxième catégorie comprend ceux dont l'éloignement des habitations n'est pas rigoureusement nécessaire, mais dont l'exploitation ne peut-être autorisée qu'à la condition que des mesures soient prises pour prévenir les dangers ou les incommodités visés à l'article 293. Dans la troisième catégorie sont placés les établissements qui ne présentent pas d'inconvénients graves ni pour la santé publique ni pour le voisinage, sont seulement soumis, sous la surveillance administrative, à des prescriptions générales édictées, dans l'intérêt du voisinage, ou de la santé publique.",,
77,1,2.0,2,2013-54,2,2013-12-30,105 / 2013,Portant loi de finances pour l'année 2014 ,"- Art 72 : Les montants annuels de la taxe de contrôle et de surveillance des établissements dangereux, insalubres et incommodes tels que fixés par le décret-loi n° 62-18 du 21 août 1962 sont modifiés comme suit : Catégories Montant annuel - Première catégorie : 2000 dinars - Deuxième catégorie : 1000 dinars - Troisième catégorie : 300 dinars",Aug_Taxe_EC_FR.pdf,
78,3,9.0,4,2005-1991,3,2005-07-11,57 / 2005,Etude d’impact sur l’environnement,"1) Sont obligatoirement soumises à l’étude d’impact sur l’environnement les unités énumérées à l’annexe 1 du présent décret. L’étude d’impact sur l’environnement doit être élaborée par des bureaux d’études ou des experts spécialisés dans le domaine. 2) Les unités énumérées à l’annexe 2 du présent décret sont soumises à un cahier des charges approuvé par arrêté du ministre chargé de l’environnement et qui fixent les mesures environnementales que le maître de l’ouvrage ou le pétitionnaire doit respecter. 3) L’activité de l’unité soumise à l’étude d’impact sur l’environnement ou au cahier des charges doit être conforme à la vocation de la zone d’implantation, aux plans d’aménagement et aux normes en vigueur relatives à la protection de l’environnement. 4) Le contenu de l’étude d’impact sur l’environnement doit refléter l’incidence prévisible de l’unité sur l’environnement et doit comprendre au minimum les éléments suivants : - Description détaillée de l’unité, - Analyse de l’état initial du site et de son environnement portant, notamment sur les éléments et les ressources naturelles susceptibles d’être affectées par la réalisation de l’unité. - Une analyse des conséquences prévisibles, directes et indirectes, de l’unité sur l’environnement, et en particulier les ressources naturelles, les différentes espèces de la faune et de la flore et les zones bénéficiant d’une protection juridique, notamment les forêts, les zones et les paysages naturels ou historiques, les zones sensibles, les espaces protégés, les parcs nationaux les parcs urbains. - Les mesures envisagées par le maître de l’ouvrage ou le pétitionnaire pour éliminer ou réduire et, si possible, compenser les conséquences dommageables de l’unité sur l’environnement et l’estimation des coûts correspondants. - Un plan détaillé de gestion environnementale de l’unité. 5) Le maître de l’ouvrage ou le pétitionnaire doit déposer trois exemplaires (3) de l’étude d’impact sur l’environnement ou un exemplaire (1) du cahier des charges signé et légalisé auprès de l’agence nationale de protection de l’environnement et en un exemplaire (1) auprès de chaque ministère habilité à intervenir dans l’octroi de l’autorisation. 6) Lorsque l’unité peut avoir un effet sur les zones bénéficiant d’une protection juridique, notamment les forêts, les zones et les paysages naturels ou historiques, les zones sensibles, les espaces protégés, les parcs nationaux, les parcs urbains et les différentes espèces de la faune et de la flore, l’agence nationale de protection de l’environnement demande l’avis du gestionnaire de ces zones ou ces espaces pour la réalisation de l’unité.",Decret_2005_1991.pdf,
79,1,20.0,4,68-88,2,1968-03-28,,"Relatif aux établissements dangereux, insalubres, ou incommodes","- Article 1 : Demandes d'autorisation Toute demande d'ouverture d'un établissement dangereux, insalubre ou incommode doit être adressée à l'ingénieur, chef de la division des industries chimiques (Secrétariat d'Etat au Plan et à l'Economie Nationale) et, à peine de nullité, satisfaire aux conditions suivantes: Identité,Emplacement, Description des installations, Etude des impacts et des dangers A ce plan sont joints des notices, légendes ou descriptions et au besoin des dessins ou croquis établis de façon à permettre de se rendre compte, d'autre part, si les dispositions matérielles projetées obvient efficacement aux inconvénients que pourraient présenter l'établissement,soit pour la sécurité, la salubrité ou la commodité du voisinage,soit pour la santé publique ou pour l'agriculture,d'autre part, si des dispositions répondent aux prescriptions édictées pour l'hygiène et la sécurité du personnel. Le mode et les conditions d'évacuation, d'utilisation et de traitement des eaux résiduaires, ainsi que des déchets et résidus de l'exploitation sont dans tous les cas spécifiés et précisés. Suivant la nature de l'industrie, l'indication des conditions d'apport à l'établissement des matières destinées à y être traitées peut aussi être exigée Plan des abords Un plan sommaire sur papier calque et à l'encre de chine dessiné à l'échelle de 1 mm/m, reproduisant l'état général des propriétés, maisons d'habitations, routes, chemins, cours d'eau, puits, égouts, etc. ... aux abords de l'emplacement projeté dans un rayon de 500 mètres pour les établissements de 1 ère classe, 200 mètres pour ceux de la 2 ème classe et 50 mètres pour ceux de la 3ème classe.Sur ce plan sont indiqués spécialement les hôpitaux ou hospices, les bâtiments publics, les écoles, les gares, dépôts. Toutefois, S'il s'agit d'un établissement de la 3 ème catégorie le demandeur n'aura à produire que le plan prévu au paragraphe précédent, ainsi qu'un croquis d'ensemble à l'échelle approximative de 5mm/m, accompagné de légendes et au besoin de descriptions matérielles de l'établissement indiquant l'affectation de constructions et terrains le joignant immédiatement.",,
81,46,107.0,3,94-29,2,1994-02-21,15 / 1994,CCE,"Article 157 (nouveau) : Il est institué dans chaque entreprise régie par les dispositions du présent code du travail et employant au moins quarante travailleurs permanents, une structure consultative dénommée ""Commission Consultative d'Entreprise"". Article 158 (nouveau) : La CCE est composée d'une façon paritaire de représentants de la direction de l'entreprise dont le chef d'entreprise et de représentants des travailleurs élus par ces derniers . La commission est présidée par le chef d'entreprise ou, en cas d'empêchement, son représentant dûment mandaté . Article 160 (nouveau) : La CCE est consultée sur les questions suivantes : a) L'organisation du travail dans l'entreprise en vue d'améliorer la production et la productivité b) Les questions se rapportant aux œuvres sociales existantes dans l'entreprise au profit des travailleurs et de leurs familles ; c) La promotion et le reclassement professionnel; d) L'apprentissage et la formation professionnelle ; e) La discipline et dans ce cas la commission s'érige en conseil de discipline et applique la procédure fixée par les textes législatifs, réglementaires ou conventionnels régissant l'entreprise.",Loi_94_29.pdf,
82,46,107.0,4,95-30,2,1995-01-09,06 / 1995,La composition et au fonctionnement du CCE et sa modalités d'élection,"Article premier : La commission consultative d'entreprise est composée d'une façon paritaire de représentants de la direction de l'entreprise dont le chef d'entreprise et de représentants des travailleurs. La commission est présidée par le chef d'entreprise ou en cas d'empêchement, par son représentant dûment mandaté. Article 2 : Les représentants de la direction sont désignés par le chef d'entreprise et les représentants des travailleurs sont élus par ces derniers. Article 3 : Le nombre des représentants de la direction de l'entreprise et celui des représentants du personnel sont fixés chacun comme suit : * 3 membres titulaires et 3 membres suppléants dans les entreprises employant entre 40 et 150 travailleurs permanents * 5 membres titulaires et 5 membres suppléants dans les entreprises employant entre 151 et 500 travailleurs permanents * 7 membres titulaires et 7 membres suppléants dans les entreprises employant plus de 500 travailleurs permanents. - Le nombre des membres de la commission consultative d'entreprise ne peut être modifié au cours du mandat en raison d'une augmentation ou d'une réduction de l'effectif de l'entreprise. Article 04 : Une commission consultative est constituée dans chaque filiale de l'entreprise si cette filiale jouit de la personnalité juridique et emploie un nombre de travailleurs permanents égal ou supérieur à quanrante. La commission consultative centrale d'entreprise est composée de membres représentant la direction de l'entreprise désignés par celle-ci et d'un nombre égal de membres représentant le personnel élus par les représentants des travailleurs dans les commissions consultatives des filiales de l'entreprise et parmi eux, sans que le nombre total des membres titulaires de la commission centrale ne dépasse quatorze",Decret_95_30.pdf,
83,2,162.0,2,2002-81,2,2003-01-03,64 / 2002,"Relative à l'exercice des activités privées de contrôle, de gardiennage, de transport de fonds et de métaux précieux","Chapitre II – De l’autorisation et ses conditions d’octroi Article 6 : Conditions d'obtention de la prestation Aucune personne physique, ni représentant légal d’une personne morale ne peut exercer les activités mentionnées à l’article premier de la présente loi s’il ne remplit pas les conditions suivantes : Etre de nationalité tunisienne depuis cinq années au moins, Jouir de ses droits civiques et politiques et ne pas avoir été condamné, en vertu d'un jugement définitif, pour un crime ou pour un délit de concussion, de détournement, de vol, d'escroquerie, de falsification, de faux, d'abus de confiance ou d'attentat à la pudeur, ou en raison de la perpétration de l'un des délits liés à la criminalité organisée ou au terrorisme. Etre connu pour sa bonne conduite, Etre immatriculé au registre du commerce, N'ayant pas fait l'objet d'une déclaration de faillite, en vertu d'un jugement définitif, N'ayant pas fait l'objet, en vertu d'une décision définitive de justice, d'une interdiction relative à la gestion ou à l'administration des sociétés ou à l'exercice d'une quelconque activité en qualité de commerçant, N'exercer aucune autre activité pofessionnelle quelle qu'en soit la nature. Chapitre III : De l’exercice des activités Article 09 : Aucun agent ne peut être recruté aux fins des activités mentionnées à l’article premier de la présente loi s’il : a. n’est pas de nationalité tunisienne depuis cinq années au moins, b. Jouir de ses droits civiques et politiques et ne pas avoir été condamné, en vertu d’un jugement définitif, pour un crime ou pour un délit de concussion, de détournement, de vol, d’escroquerie, de falsification, de faux, d’abus de confiance ou d’attentat à la pudeur, ou en raison de la perpétration de l’un des délits liés à la criminalité organisée ou au terrorisme, et ce, conformément aux énonciations du bulletin d’antécédents judiciaires n° 2, ou avoir bénéficié de la réhabilitation du chef des autres délits, 3 c. n’est pas connu pour sa bonne conduite, d. n’a pas atteint au moins l’âge de vingt ans, e. n’a pas accompli, avec succès, au moins la neuvième année de l’enseignement de base ou ne justifie pas d’un niveau équivalent, f. n’a pas l’aptitude physique, mentale et psychique requise pour l’exercice de l’activité. Article 12 : Est résilié de plein droit, le contrat de travail de l’agent qui ne remplit plus l’une des trois premières conditions prévues à l’article 11 de la présente loi. Toutefois, si la condition d’aptitude physique, mentale et psychique vient à faire défaut, le contrat de travail n’est résilié que s’il n’a pas été possible d’occuper l’agent dans un emploi autre que celui qui répond à la nature des activités mentionnées à l’article premier de la présente loi, et ce, après avis des services de l’inspection du travail, et des services de l’inspection de la médecine du travail territorialement compétents. Article 14 : Les agents, exerçant l’une des activités mentionnées à l’article premier de la présente loi, doivent avoir une carte professionnelle qui leur est remise par leur employeur, conformément à un spécimen qui sera défini par arrêté du ministre de l’intérieur.",Loi_2002_81.pdf,
84,2,162.0,3,2008-14,2,2008-02-18,16 / 2008,Modifiant et complétant la loi n° 2002-81 du 3 août 2002,"Article 11 (alinéa premier - deuxième tiret nouveau) : Jouir de ses droits civiques et politiques et ne pas avoir été condamné, en vertu d’un jugement définitif, pour un crime ou pour un délit de concussion, de détournement, de vol, d’escroquerie, de falsification, de faux, d’abus de confiance ou d’attentat à la pudeur, ou en raison de la perpétration de l’un des délits liés à la criminalité organisée ou au terrorisme, et ce, conformément aux énonciations du bulletin d’antécédents judiciaires n° 2, ou avoir bénéficié de la réhabilitation du chef des autres délits Article 11 (troisième alinéa - nouveau) : L’employeur dispense, aux agents recrutés, une formation de base et continue, dans le domaine d’activité pour lequel le recrutement a été opéré, et ce, dans les espaces réservés par l’établissement concerné et par des formateurs relevant des écoles de la sûreté nationale, moyennant rémunération, et conformément à une convention conclue à cet effet. Le cycle de formation est sanctionné par la délivrance d’un certificat d’aptitude professionnelle remis par l’école concernée. Les programmes de formation et les conditions de délivrance dudit certificat sont fixés par arrêté du ministre de l’intérieur. le 6 (deuxième tiret nouveau) : Jouir de ses droits civiques et politiques et ne pas avoir été condamné, en vertu d’un jugement définitif, pour un crime ou pour un délit de concussion, de détournement, de vol, d’escroquerie, de falsification, de faux, d’abus de confiance ou d’attentat à la pudeur, ou en raison de la perpétration de l’un des délits liés à la criminalité organisée ou au terrorisme, et ce, conformément aux énonciations du bulletin d’antécédents judiciaires n° 2, ou avoir bénéficié de la réhabilitation du chef des autres délits.",2008_14.pdf,
85,2,21.0,3,91-39,2,1991-06-08,43 / 1991,"la lutte contre les calamités, à leur prévention et à l'organisation des secours","Article premier : Relative à la lutte contre les calamités, à leur prévention et à l'organisation des secours",Loi_91_39-0.pdf,
86,2,21.0,4,2007-1366,2,2007-06-11,47 / 2007,Détermination des étapes d’application de la loi n° 2004-71 du 2 août 2004,"Portant détermination des étapes d’application de la loi n° 2004-71 du 2 août 2004, portant institution d’un régime d’assurance maladie aux différentes catégories d’assurés sociaux mentionnés dans les différents régimes légaux de sécurité sociale. - Article premier: A compter du 1èr juillet 2007, les dispositions de la loi n° 2004-71 du 2 août 2004, portant institution d’un régime d’assurance maladie s’appliquent aux assurés sociaux ci-après mentionnées : * les affiliés à la caisse nationale de retraite et de prévoyance sociale, * les affiliés à la caisse nationale de sécurité sociale assujettis aux régimes de sécurité sociale suivants : - le régime des travailleurs salariés dans le secteur non agricole institué par la loi n° 60-30 du 14 décembre 1960 susvisée, - le régime de sécurité sociale dans le secteur agricole institué par la loi n° 81-6 du 12 février 1981, telle que modifiée et complétée par la loi n° 89-73 du 2 septembre 1989, - le régime de sécurité sociale des artistes, des créateurs et des intellectuels prévu par la loi n° 2002-104 du 30 décembre 2002, - le régime de sécurité sociale des travailleurs Tunisiens à l’étranger prévu par le décret n° 89-107 du 10 janvier 1989 susvisé, - le régime des travailleurs non salariés dans le secteur agricole et non agricole prévu par le décret n° 95-1166 du 3 juillet 1995 susvisé.",2007_1366.pdf,
87,2,21.0,4,2009-2375,2,2009-08-24,69 / 2009,Institution et organisation du prix national de santé et de sécurité au travail,"1) Il est institué un prix dénommé « prix national de santé et de sécurité au travail » octroyé aux entreprises régies par le code du travail qui se sont distinguées par leurs efforts continus dans le domaine de santé et de sécurité au travail en vue d’aménager les postes du travail et de réunir les conditions adéquates pour la préservation de la santé au sein de l’entreprise et le renforcement de la prévention des risques professionnels. 2) Les candidatures pour l’obtention du prix national de santé et de sécurité au travail sont déposées par les entreprises concernées au siège du gouvernorat territorialement compétent avant le 31 décembre de chaque année. 3) Le prix national de santé et de sécurité au travail est décerné le 1er mai de chaque année par arrêté du ministre des affaires sociales, de la solidarité et des Tunisiens à l’étranger, sur proposition de la commission nationale. 4) Les candidatures des entreprises ayant obtenu le prix national de santé et de sécurité au travail ne peuvent être retenues de nouveau qu’après dix ans à partir de la date de leur obtention du dernier prix. 5) Le montant du prix national de santé et de sécurité au travail est fixé à dix milles dinars. 6) L’entreprise bénéficiaire du prix reçoit un certificat signé par le ministre des affaires sociales, de la solidarité et des Tunisiens à l’étranger.",Decret_2009_2375.pdf,
